tweet_id,name,screen_name,retweet_count,text,mined_at,created_at,favourite_count,hashtags,status_count,location,source_device,retweet_text,quote_text,quote_screen_name
1382249384859955201,Rohit Sharma,ImRo45,2784,"I walk out with my cause but it won’t end there, I need you guys to walk with me. Let’s get our oceans healthy again. 🌊🐠🐋🦈🐬🐳🦭 (2/2)",2021-04-15 13:36:42.781068,2021-04-14 08:28:28+00:00,26819,[],2510,,Twitter for iPhone,None,None,None
1382249262902235138,Rohit Sharma,ImRo45,5557,The other cause that’s extremely close to my heart. This one hits hard! This is a hundred percent in our control to reverse. I take my cause with me while I go out and do what I love! (1/2) https://t.co/ZF5xP1zy9k,2021-04-15 13:36:42.781068,2021-04-14 08:27:59+00:00,61746,[],2510,,Twitter for iPhone,None,None,None
1380897318182907905,Rohit Sharma,ImRo45,1325,"It’s #ElClásico time! 

Very excited for the game. I’m rooting for @realmadriden. What’s your pick? @LaLigaEN",2021-04-15 13:36:42.781068,2021-04-10 14:55:51+00:00,12799,"[{'text': 'ElClásico', 'indices': [5, 15]}]",2510,,Twitter for iPhone,None,None,None
1380787208743911426,Rohit Sharma,ImRo45,2833,It was special for me to take a cause so close to my heart with me on the field while I do what I love. Every step matters. 🦏❤️ (2/2),2021-04-15 13:36:42.781068,2021-04-10 07:38:19+00:00,34557,[],2510,,Twitter for iPhone,None,None,None
1380787077055270912,Rohit Sharma,ImRo45,7256,Yesterday when I walked on to the field it was more than just a game for me. Playing cricket is my dream and helping make this world a better place is a cause we all need to work towards. (1/2) https://t.co/fM22VolbYq,2021-04-15 13:36:42.781068,2021-04-10 07:37:47+00:00,95721,[],2510,,Twitter for iPhone,None,None,None
1380379090717343744,Rohit Sharma,ImRo45,3693,The 🄲🄰🅄🅂🄴🅂 I support ❤️ Stay tuned! 😉 https://t.co/L8q8UiHwur,2021-04-15 13:36:42.781068,2021-04-09 04:36:36+00:00,43153,[],2510,,Twitter for iPhone,None,None,None
1379657745448636421,Rohit Sharma,ImRo45,2462,"Team effort isse kehte hai. Just like our @mipaltan  team!😃

📽️ https://t.co/sM2U9QaRmK

@Jaspritbumrah93 @krunalpandya24 @hardikpandya7 @QuinnyDeKock69 #TeamHaiTohMazaaHai",2021-04-15 13:36:42.781068,2021-04-07 04:50:13+00:00,28987,"[{'text': 'TeamHaiTohMazaaHai', 'indices': [153, 172]}]",2510,,Twitter Web App,None,None,None
1379396795420184581,Rohit Sharma,ImRo45,6369,"Hello Paltan! We’re getting closer to the opening match of #VIVOIPL, where we will face one of the best teams in RCB.

Jeet ke liye kaun sa mantra try karoon? Share your thoughts using #RohitMantra.

Mark your calendars – April 9, 7:30 PM ko #SabKuchRoKo!",2021-04-15 13:36:42.781068,2021-04-06 11:33:18+00:00,75593,"[{'text': 'VIVOIPL', 'indices': [59, 67]}, {'text': 'RohitMantra', 'indices': [185, 197]}, {'text': 'SabKuchRoKo', 'indices': [242, 254]}]",2510,,Twitter for iPhone,None,None,None
1378986791848407041,Rohit Sharma,ImRo45,3663,"Another day another set 😰Lights, camera ..... #IPL https://t.co/EZU3JZ1XhJ",2021-04-15 13:36:42.781068,2021-04-05 08:24:06+00:00,70798,"[{'text': 'IPL', 'indices': [46, 50]}]",2510,"Place(_api=<tweepy.api.API object at 0x00000260A2B20E88>, id='50cc45b2c2e65034', url='https://api.twitter.com/1.1/geo/id/50cc45b2c2e65034.json', place_type='city', name='Chengalpattu', full_name='Chengalpattu, India', country_code='IN', country='India', contained_within=[], bounding_box=BoundingBox(_api=<tweepy.api.API object at 0x00000260A2B20E88>, type='Polygon', coordinates=[[[79.876158, 12.463782], [80.255545, 12.463782], [80.255545, 12.879191], [79.876158, 12.879191]]]), attributes={})",Twitter for iPhone,None,None,None
1376522717445296128,Rohit Sharma,ImRo45,3412,"Wishing all @LaLigaEN fans a happy &amp; safe Holi.

#laligasantander #happyholi https://t.co/qkHPIdOjSU",2021-04-15 13:36:42.781068,2021-03-29 13:12:45+00:00,45339,"[{'text': 'laligasantander', 'indices': [53, 69]}, {'text': 'happyholi', 'indices': [70, 80]}]",2510,,Twitter for iPhone,None,None,None
1374701576036642817,Rohit Sharma,ImRo45,3115,"Hitman ko lagta hai ki yeh anthem superhit hai! 😎

Ab har gali mein goonjega #IndiaKaApnaMantra.

Aap bhi dekho @IPL aur @StarSportsIndia ka naya #VIVOIPL Anthem aur share karo #IndiaKaApnaMantra. https://t.co/eNm1ABZMe2",2021-04-15 13:36:42.781068,2021-03-24 12:36:11+00:00,31019,"[{'text': 'IndiaKaApnaMantra', 'indices': [77, 95]}, {'text': 'VIVOIPL', 'indices': [146, 154]}, {'text': 'IndiaKaApnaMantra', 'indices': [177, 195]}]",2510,,Twitter for iPhone,None,None,None
1373515699792998401,Rohit Sharma,ImRo45,11519,Outstanding presentation of skills and mindset through the series by everyone 👌Fantastic series win for India. We move on 👏 https://t.co/gBm9PzbuNd,2021-04-15 13:36:42.781068,2021-03-21 06:03:56+00:00,160924,[],2510,"Place(_api=<tweepy.api.API object at 0x00000260A2B20E88>, id='272983f6b52c196e', url='https://api.twitter.com/1.1/geo/id/272983f6b52c196e.json', place_type='city', name='Ahmadabad City', full_name='Ahmadabad City, India', country_code='IN', country='India', contained_within=[], bounding_box=BoundingBox(_api=<tweepy.api.API object at 0x00000260A2B20E88>, type='Polygon', coordinates=[[[72.4367386, 22.9232559], [72.7037246, 22.9232559], [72.7037246, 23.1046616], [72.4367386, 23.1046616]]]), attributes={})",Twitter for iPhone,None,None,None
1368209851008962560,Rohit Sharma,ImRo45,10593,Great finish to a fantastic test series. We now look forward to World Test Championship 😁 @BCCI https://t.co/H1Q9NkWrgD,2021-04-15 13:36:42.781068,2021-03-06 14:40:23+00:00,151170,[],2510,"Place(_api=<tweepy.api.API object at 0x00000260A2B20E88>, id='272983f6b52c196e', url='https://api.twitter.com/1.1/geo/id/272983f6b52c196e.json', place_type='city', name='Ahmadabad City', full_name='Ahmadabad City, India', country_code='IN', country='India', contained_within=[], bounding_box=BoundingBox(_api=<tweepy.api.API object at 0x00000260A2B20E88>, type='Polygon', coordinates=[[[72.4367386, 22.9232559], [72.7037246, 22.9232559], [72.7037246, 23.1046616], [72.4367386, 23.1046616]]]), attributes={})",Twitter for iPhone,None,None,None
1366714007843790850,Rohit Sharma,ImRo45,5492,"This is us ringing Pujara’s door bell and scampering, after fielding for 2 days 😀 @cheteshwar1  @imkuldeep18 https://t.co/iuYZwxLBaF",2021-04-15 13:36:42.781068,2021-03-02 11:36:26+00:00,102793,[],2510,,Twitter for iPhone,None,None,None
1364983980043300871,Rohit Sharma,ImRo45,11143,Good win for team. Huge compliments to @ashwinravi99 for reaching 400 test wickets and @ImIshant for appearing 100 times in the test cricket. Brilliant feat guys 👏👏,2021-04-15 13:36:42.781068,2021-02-25 17:01:55+00:00,159227,[],2510,"Place(_api=<tweepy.api.API object at 0x00000260A2B20E88>, id='272983f6b52c196e', url='https://api.twitter.com/1.1/geo/id/272983f6b52c196e.json', place_type='city', name='Ahmadabad City', full_name='Ahmadabad City, India', country_code='IN', country='India', contained_within=[], bounding_box=BoundingBox(_api=<tweepy.api.API object at 0x00000260A2B20E88>, type='Polygon', coordinates=[[[72.4367386, 22.9232559], [72.7037246, 22.9232559], [72.7037246, 23.1046616], [72.4367386, 23.1046616]]]), attributes={})",Twitter for iPhone,None,None,None
1362733871213649920,Rohit Sharma,ImRo45,4864,Welcome to the city of heroics! https://t.co/RndgQzzmzy,2021-04-15 13:36:42.781068,2021-02-19 12:00:47+00:00,57968,[],2510,,Twitter Media Studio,None,None,None
1362378166900195332,Rohit Sharma,ImRo45,6549,Great work so far @mipaltan 👍😁,2021-04-15 13:36:42.781068,2021-02-18 12:27:21+00:00,92708,[],2510,"Place(_api=<tweepy.api.API object at 0x00000260A2B20E88>, id='272983f6b52c196e', url='https://api.twitter.com/1.1/geo/id/272983f6b52c196e.json', place_type='city', name='Ahmadabad City', full_name='Ahmadabad City, India', country_code='IN', country='India', contained_within=[], bounding_box=BoundingBox(_api=<tweepy.api.API object at 0x00000260A2B20E88>, type='Polygon', coordinates=[[[72.4367386, 22.9232559], [72.7037246, 22.9232559], [72.7037246, 23.1046616], [72.4367386, 23.1046616]]]), attributes={})",Twitter for iPhone,None,None,None
1360607424361549824,Rohit Sharma,ImRo45,9166,Fingers seem to be fine. Sammy and I giving mamma a little rub on sore fingers 😄 🤞 https://t.co/lsQ21f19Me,2021-04-15 13:36:42.781068,2021-02-13 15:11:03+00:00,156654,[],2510,"Place(_api=<tweepy.api.API object at 0x00000260A2B20E88>, id='03b7ea94ef68e9d7', url='https://api.twitter.com/1.1/geo/id/03b7ea94ef68e9d7.json', place_type='city', name='Mylapore Tiruvallike', full_name='Mylapore Tiruvallike, India', country_code='IN', country='India', contained_within=[], bounding_box=BoundingBox(_api=<tweepy.api.API object at 0x00000260A2B20E88>, type='Polygon', coordinates=[[[80.2348852, 12.970918], [80.288726, 12.970918], [80.288726, 13.0778711], [80.2348852, 13.0778711]]]), attributes={})",Twitter for iPhone,None,None,None
1357029409593561088,Rohit Sharma,ImRo45,33469,India has always been stronger when we all stand together and finding a solution is the need of the hour. Our farmers play an important role in our nation’s well being and I am sure everyone will play their roles to find a solution TOGETHER. #IndiaTogether 🇮🇳,2021-04-15 13:36:42.781068,2021-02-03 18:13:18+00:00,208340,"[{'text': 'IndiaTogether', 'indices': [242, 256]}]",2510,,Twitter for iPhone,None,None,None
1355833490080559107,Rohit Sharma,ImRo45,7333,"RT @PMOIndia: इस महीने, क्रिकेट पिच से भी बहुत अच्छी खबर मिली | हमारी क्रिकेट टीम ने शुरुआती दिक्कतों के बाद, शानदार वापसी करते हुए ऑस्ट्रे…",2021-04-15 13:36:42.781068,2021-01-31 11:01:08+00:00,0,[],2510,,Twitter for iPhone,"इस महीने, क्रिकेट पिच से भी बहुत अच्छी खबर मिली | हमारी क्रिकेट टीम ने शुरुआती दिक्कतों के बाद, शानदार वापसी करते हुए ऑस्ट्रेलिया में सीरीज जीती | हमारे खिलाड़ियों का hard work और teamwork प्रेरित करने वाला है : PM @narendramodi #MannKiBaat",None,None
1354338381568700417,Rohit Sharma,ImRo45,2177,"Congratulations team, @R1SEWorldwide.
Looking forward to continuing our wonderful partnership. 👊 #RISEasOne https://t.co/3WzmLJnFoM",2021-04-15 13:36:42.781068,2021-01-27 08:00:07+00:00,31506,"[{'text': 'RISEasOne', 'indices': [97, 107]}]",2510,,Twitter Media Studio,None,None,None
1353941314706915333,Rohit Sharma,ImRo45,7500,"Pride, love and passion for 🇮🇳

Wishing you all a #HappyRepublicDay! https://t.co/gddLDjnvar",2021-04-15 13:36:42.781068,2021-01-26 05:42:19+00:00,126968,"[{'text': 'HappyRepublicDay', 'indices': [50, 67]}]",2510,,Twitter for iPhone,None,None,None
1351504991530278914,Rohit Sharma,ImRo45,18172,An indescribable feeling for an indestructible team. No matter what hardships came our way we made it through. Everyone played fearlessly and it was truly a treat to watch. A game to remember forever. @BCCI https://t.co/kMuXBTEbkK,2021-04-15 13:36:42.781068,2021-01-19 12:21:14+00:00,227436,[],2510,"Place(_api=<tweepy.api.API object at 0x00000260A2B20E88>, id='004ec16c62325149', url='https://api.twitter.com/1.1/geo/id/004ec16c62325149.json', place_type='city', name='Brisbane', full_name='Brisbane, Queensland', country_code='AU', country='Australia', contained_within=[], bounding_box=BoundingBox(_api=<tweepy.api.API object at 0x00000260A2B20E88>, type='Polygon', coordinates=[[[152.668522848, -27.767440994], [153.31787024, -27.767440994], [153.31787024, -26.996844991], [152.668522848, -26.996844991]]]), attributes={})",Twitter for iPhone,None,None,None
1348643774142955528,Rohit Sharma,ImRo45,12343,Incredible feeling this. Congratulations to both of you. God bless. https://t.co/E6SRHcazyr,2021-04-15 13:36:42.781068,2021-01-11 14:51:47+00:00,162409,[],2510,,Twitter for iPhone,None,None,None
1348617069172977668,Rohit Sharma,ImRo45,13974,What a test match. Great effort Team India 🇮🇳 @bcci https://t.co/RxV3TMB7Wu,2021-04-15 13:36:42.781068,2021-01-11 13:05:40+00:00,248715,[],2510,"Place(_api=<tweepy.api.API object at 0x00000260A2B20E88>, id='0073b76548e5984f', url='https://api.twitter.com/1.1/geo/id/0073b76548e5984f.json', place_type='city', name='Sydney', full_name='Sydney, New South Wales', country_code='AU', country='Australia', contained_within=[], bounding_box=BoundingBox(_api=<tweepy.api.API object at 0x00000260A2B20E88>, type='Polygon', coordinates=[[[150.520928608, -34.1183470085], [151.343020992, -34.1183470085], [151.343020992, -33.578140996], [150.520928608, -33.578140996]]]), attributes={})",Twitter for iPhone,None,None,None
1343778615008194562,Rohit Sharma,ImRo45,10287,Fantastic win for the Team India at the MCG. Character and composure shown throughout the game was excellent to watch @bcci,2021-04-15 13:36:42.781068,2020-12-29 04:39:22+00:00,167392,[],2510,"Place(_api=<tweepy.api.API object at 0x00000260A2B20E88>, id='0073b76548e5984f', url='https://api.twitter.com/1.1/geo/id/0073b76548e5984f.json', place_type='city', name='Sydney', full_name='Sydney, New South Wales', country_code='AU', country='Australia', contained_within=[], bounding_box=BoundingBox(_api=<tweepy.api.API object at 0x00000260A2B20E88>, type='Polygon', coordinates=[[[150.520928608, -34.1183470085], [151.343020992, -34.1183470085], [151.343020992, -33.578140996], [150.520928608, -33.578140996]]]), attributes={})",Twitter for iPhone,None,None,None
1342330834557095937,Rohit Sharma,ImRo45,4302,Merry Christmas to all and happy holidays! Miss you my girls @ritssajdeh  🎄 https://t.co/wNetCHdJ6A,2021-04-15 13:36:42.781068,2020-12-25 04:46:24+00:00,102654,[],2510,"Place(_api=<tweepy.api.API object at 0x00000260A2B20E88>, id='0073b76548e5984f', url='https://api.twitter.com/1.1/geo/id/0073b76548e5984f.json', place_type='city', name='Sydney', full_name='Sydney, New South Wales', country_code='AU', country='Australia', contained_within=[], bounding_box=BoundingBox(_api=<tweepy.api.API object at 0x00000260A2B20E88>, type='Polygon', coordinates=[[[150.520928608, -34.1183470085], [151.343020992, -34.1183470085], [151.343020992, -33.578140996], [150.520928608, -33.578140996]]]), attributes={})",Twitter for iPhone,None,None,None
1341628458275909632,Rohit Sharma,ImRo45,4817,"Congratulations bro, best wishes to both of you. Keep those googlies for opposition not her 😉 https://t.co/LJFWnLhYbA",2021-04-15 13:36:42.781068,2020-12-23 06:15:25+00:00,109455,[],2510,"Place(_api=<tweepy.api.API object at 0x00000260A2B20E88>, id='0073b76548e5984f', url='https://api.twitter.com/1.1/geo/id/0073b76548e5984f.json', place_type='city', name='Sydney', full_name='Sydney, New South Wales', country_code='AU', country='Australia', contained_within=[], bounding_box=BoundingBox(_api=<tweepy.api.API object at 0x00000260A2B20E88>, type='Polygon', coordinates=[[[150.520928608, -34.1183470085], [151.343020992, -34.1183470085], [151.343020992, -33.578140996], [150.520928608, -33.578140996]]]), attributes={})",Twitter for iPhone,None,None,None
1338118418134753280,Rohit Sharma,ImRo45,5491,5 yrs down....lifetime to go @ritssajdeh 😍 https://t.co/PoYknOjLN5,2021-04-15 13:36:42.781068,2020-12-13 13:47:46+00:00,141427,[],2510,,Twitter for iPhone,None,None,None
1338053669648887808,Rohit Sharma,ImRo45,3745,@StarSportsIndia More to come 😊,2021-04-15 13:36:42.781068,2020-12-13 09:30:29+00:00,26733,[],2510,"Place(_api=<tweepy.api.API object at 0x00000260A2B20E88>, id='7929cea6bd5b32bd', url='https://api.twitter.com/1.1/geo/id/7929cea6bd5b32bd.json', place_type='city', name='Mumbai', full_name='Mumbai, India', country_code='IN', country='India', contained_within=[], bounding_box=BoundingBox(_api=<tweepy.api.API object at 0x00000260A2B20E88>, type='Polygon', coordinates=[[[72.74484, 18.845343], [73.003648, 18.845343], [73.003648, 19.502937], [72.74484, 19.502937]]]), attributes={})",Twitter for iPhone,None,None,None
1335561631732908032,Rohit Sharma,ImRo45,9535,What a series win for Team India. Loved the way they played nice and composed. Big 👍 to each one of them. @BCCI,2021-04-15 13:36:42.781068,2020-12-06 12:28:01+00:00,187078,[],2510,"Place(_api=<tweepy.api.API object at 0x00000260A2B20E88>, id='1b8680cd52a711cb', url='https://api.twitter.com/1.1/geo/id/1b8680cd52a711cb.json', place_type='city', name='Bengaluru', full_name='Bengaluru, India', country_code='IN', country='India', contained_within=[], bounding_box=BoundingBox(_api=<tweepy.api.API object at 0x00000260A2B20E88>, type='Polygon', coordinates=[[[77.373474, 12.919037], [77.739371, 12.919037], [77.739371, 13.231381], [77.373474, 13.231381]]]), attributes={})",Twitter for iPhone,None,None,None
1331892953774579713,Rohit Sharma,ImRo45,1440,"Bhai bhai ke beech mein, ek shaana aur doosra dedh shaana... #YeMainKarLetaHoon @Dream11 https://t.co/dsUxzpXStY",2021-04-15 13:36:42.781068,2020-11-26 09:30:00+00:00,33579,"[{'text': 'YeMainKarLetaHoon', 'indices': [61, 79]}]",2510,,Twitter Media Studio,None,None,None
1327623186674896904,Rohit Sharma,ImRo45,7387,Happy Diwali to all. Lighten up with your loved ones. Stay safe and sound 😁 🪔 @ritssajdeh https://t.co/oXwR3uQ3Yx,2021-04-15 13:36:42.781068,2020-11-14 14:43:28+00:00,186494,[],2510,,Twitter for iPhone,None,None,None
1326893797247078401,Rohit Sharma,ImRo45,5212,Have to admire the commitment &amp; discipline shown by @ipl and @BCCI crew for the smooth and safe conduct of the #IPL2020. Also a big hand to all 8 franchise for creating a safe bio secure bubble for teams and family 👏 👏,2021-04-15 13:36:42.781068,2020-11-12 14:25:08+00:00,104343,"[{'text': 'IPL2020', 'indices': [115, 123]}]",2510,"Place(_api=<tweepy.api.API object at 0x00000260A2B20E88>, id='7929cea6bd5b32bd', url='https://api.twitter.com/1.1/geo/id/7929cea6bd5b32bd.json', place_type='city', name='Mumbai', full_name='Mumbai, India', country_code='IN', country='India', contained_within=[], bounding_box=BoundingBox(_api=<tweepy.api.API object at 0x00000260A2B20E88>, type='Polygon', coordinates=[[[72.74484, 18.845343], [73.003648, 18.845343], [73.003648, 19.502937], [72.74484, 19.502937]]]), attributes={})",Twitter for iPhone,None,None,None
1326793747238096896,Rohit Sharma,ImRo45,5525,We indeed went even this season. Bola tha aapko mamu inki ganit weak hai 😁😁 @mipaltan @StarSportsIndia https://t.co/W81Cp0U29m,2021-04-15 13:36:42.781068,2020-11-12 07:47:34+00:00,63968,[],2510,"Place(_api=<tweepy.api.API object at 0x00000260A2B20E88>, id='00f24ae701a1207b', url='https://api.twitter.com/1.1/geo/id/00f24ae701a1207b.json', place_type='admin', name='Abu Dhabi', full_name='Abu Dhabi, United Arab Emirates', country_code='AE', country='United Arab Emirates', contained_within=[], bounding_box=BoundingBox(_api=<tweepy.api.API object at 0x00000260A2B20E88>, type='Polygon', coordinates=[[[51.2938738, 22.6261387], [56.0175464, 22.6261387], [56.0175464, 25.1639588], [51.2938738, 25.1639588]]]), attributes={})",Twitter for iPhone,None,None,None
1326365546225537025,Rohit Sharma,ImRo45,10873,Valiant effort through the season. Loved being part of it. What an experience @mipaltan #OneFamily https://t.co/3tcbCUqgnc,2021-04-15 13:36:42.781068,2020-11-11 03:26:03+00:00,152296,"[{'text': 'OneFamily', 'indices': [88, 98]}]",2510,"Place(_api=<tweepy.api.API object at 0x00000260A2B20E88>, id='00f24ae701a1207b', url='https://api.twitter.com/1.1/geo/id/00f24ae701a1207b.json', place_type='admin', name='Abu Dhabi', full_name='Abu Dhabi, United Arab Emirates', country_code='AE', country='United Arab Emirates', contained_within=[], bounding_box=BoundingBox(_api=<tweepy.api.API object at 0x00000260A2B20E88>, type='Polygon', coordinates=[[[51.2938738, 22.6261387], [56.0175464, 22.6261387], [56.0175464, 25.1639588], [51.2938738, 25.1639588]]]), attributes={})",Twitter for iPhone,None,None,None
1322114534073663488,Rohit Sharma,ImRo45,4195,A must read book #CricketDrona about a great man in the cricketing fraternity. Vasu sir has been one of the influential people in my career in guiding me through the right path and giving me confidence in my younger days which helped me a great deal. https://t.co/Kw7j9oz7lW,2021-04-15 13:36:42.781068,2020-10-30 09:54:03+00:00,80331,"[{'text': 'CricketDrona', 'indices': [17, 30]}]",2510,"Place(_api=<tweepy.api.API object at 0x00000260A2B20E88>, id='00f24ae701a1207b', url='https://api.twitter.com/1.1/geo/id/00f24ae701a1207b.json', place_type='admin', name='Abu Dhabi', full_name='Abu Dhabi, United Arab Emirates', country_code='AE', country='United Arab Emirates', contained_within=[], bounding_box=BoundingBox(_api=<tweepy.api.API object at 0x00000260A2B20E88>, type='Polygon', coordinates=[[[51.2938738, 22.6261387], [56.0175464, 22.6261387], [56.0175464, 25.1639588], [51.2938738, 25.1639588]]]), attributes={})",Twitter for iPhone,None,None,None
1319330534204436480,Rohit Sharma,ImRo45,2597,"While I’m busy striking the right balance between me time &amp; field time, here is something for you. Check out #CEATBalanceTheBatChallenge! So what if you can’t beat me on-field? Try here! I nominate @abhisheknayar1 &amp; @vikramsathaye to beat me! #Dream11IPL #CEATTyreStrategicTimeout https://t.co/CRvzTpV6NX",2021-04-15 13:36:42.781068,2020-10-22 17:31:25+00:00,39560,"[{'text': 'CEATBalanceTheBatChallenge', 'indices': [113, 140]}, {'text': 'Dream11IPL', 'indices': [251, 262]}, {'text': 'CEATTyreStrategicTimeout', 'indices': [263, 288]}]",2510,,Twitter for iPhone,None,None,None
1316406102188318720,Rohit Sharma,ImRo45,6135,Bit late. Wish you a great day @GautamGambhir have a cracking year ahead 🎂 https://t.co/EPa1JHk75S,2021-04-15 13:36:42.781068,2020-10-14 15:50:47+00:00,120475,[],2510,"Place(_api=<tweepy.api.API object at 0x00000260A2B20E88>, id='00f24ae701a1207b', url='https://api.twitter.com/1.1/geo/id/00f24ae701a1207b.json', place_type='admin', name='Abu Dhabi', full_name='Abu Dhabi, United Arab Emirates', country_code='AE', country='United Arab Emirates', contained_within=[], bounding_box=BoundingBox(_api=<tweepy.api.API object at 0x00000260A2B20E88>, type='Polygon', coordinates=[[[51.2938738, 22.6261387], [56.0175464, 22.6261387], [56.0175464, 25.1639588], [51.2938738, 25.1639588]]]), attributes={})",Twitter for iPhone,None,None,None
1316389331729219584,Rohit Sharma,ImRo45,858,"Hey guys, go grab one from my favourite collection of Aristocrat bags this festive season and travel in style! You could also avail of some amazing offers on https://t.co/xCdJdjnGC4 or https://t.co/CRtgboM776. So go ahead - #UnpackYourDreams https://t.co/wzRVB2vbPG",2021-04-15 13:36:42.781068,2020-10-14 14:44:08+00:00,11243,"[{'text': 'UnpackYourDreams', 'indices': [224, 241]}]",2510,,Twitter for iPhone,None,None,None
1315970542231576576,Rohit Sharma,ImRo45,1309,"Hum hain #TeamBharatPe, jo desh ke har dukandar ke saath hain khade! 

Ab payment accept karein kisi bhi card aur app se bina koi charge aur milein cricket stars se!

🇮🇳 BharatPe Lagao Dhandha Badhao @bharatpeindia https://t.co/kWF9oHOm3o",2021-04-15 13:36:42.781068,2020-10-13 11:00:01+00:00,16987,"[{'text': 'TeamBharatPe', 'indices': [9, 22]}]",2510,,Twitter Media Studio,None,None,None
1315671651523072000,Rohit Sharma,ImRo45,351,#Foxstarstudios @akshaykumar @aliaa08 @YUVSTRONG12 @kunalkemmu @advani_kiara @offl_Lawrence @Shabinaa_Ent @tusshkapoor @foxstarhindi #CapeOfGoodFilms #ShabinaaEntertainment #TussharEntertainmentHouse  @ZeeMusicCompany,2021-04-15 13:36:42.781068,2020-10-12 15:12:20+00:00,4881,"[{'text': 'Foxstarstudios', 'indices': [0, 15]}, {'text': 'CapeOfGoodFilms', 'indices': [133, 149]}, {'text': 'ShabinaaEntertainment', 'indices': [150, 172]}, {'text': 'TussharEntertainmentHouse', 'indices': [173, 199]}]",2510,,Twitter Web App,None,None,None
1315671602114097152,Rohit Sharma,ImRo45,1661,"Keep your Popcorn🍿 Nachos, Coke🥤 Cushions and blankets ready as #LaxmmiBomb 💥 and more blockbusters are coming directly to your home soon. Watch First Day First Show ki home delivery, Dream11 IPL and exclusive Hotstar Specials only on @disneyplusHSVIP! https://t.co/xAtEqJUfQM",2021-04-15 13:36:42.781068,2020-10-12 15:12:08+00:00,19869,"[{'text': 'LaxmmiBomb', 'indices': [64, 75]}]",2510,,Twitter Media Studio,None,None,None
1315418897672269826,Rohit Sharma,ImRo45,4814,Loved representing this jersey for the 150th time. This is and always will be my home. Appreciate everyone who has helped me through this journey 👊 @mipaltan 💙 https://t.co/YkdDpIiwWP,2021-04-15 13:36:42.781068,2020-10-11 22:27:59+00:00,73948,[],2510,,Twitter for iPhone,None,None,None
1314472648638824448,Rohit Sharma,ImRo45,2959,".@SDhawan25, can u do better than this? I nominate you for #TheSahiHaiChallenge. #MutualFundsSahiHai @MFSahiHai https://t.co/Wcd8eOc14o",2021-04-15 13:36:42.781068,2020-10-09 07:47:55+00:00,44056,"[{'text': 'TheSahiHaiChallenge', 'indices': [59, 79]}, {'text': 'MutualFundsSahiHai', 'indices': [81, 100]}]",2510,,Twitter for iPhone,None,None,None
