tweet_id,name,screen_name,retweet_count,text,mined_at,created_at,favourite_count,hashtags,status_count,location,source_device,retweet_text,quote_text,quote_screen_name
813025036084871169,Rohit Sharma,ImRo45,408,"Merry Christmas 🎄 to all hope the coming year brings joy, prosperity and love ❤️ #SpreadLove",2021-04-15 13:36:49.422994,2016-12-25 14:14:08+00:00,3890,"[{'text': 'SpreadLove', 'indices': [81, 92]}]",2510,,Twitter for iPhone,None,None,None
812927085115244544,Rohit Sharma,ImRo45,623,Great meeting this under-16 Mumbai girls team. Such an enthusiastic bunch! Took me back to when I first started https://t.co/fj50oQp1Ka,2021-04-15 13:36:49.422994,2016-12-25 07:44:55+00:00,8131,[],2510,,Twitter for iPhone,None,None,None
812355618031935488,Rohit Sharma,ImRo45,662,"Congratulations Indian under - 19 team for winning the finals, winning away from home is always tough,way to go lads #YouthAsiaCup",2021-04-15 13:36:49.422994,2016-12-23 17:54:06+00:00,5532,"[{'text': 'YouthAsiaCup', 'indices': [117, 130]}]",2510,,Twitter for iPhone,None,None,None
811283947137044481,Rohit Sharma,ImRo45,273,Happiest birthday @ritssajdeh,2021-04-15 13:36:49.422994,2016-12-20 18:55:40+00:00,2565,[],2510,,Twitter for iPhone,None,None,None
811283419850162176,Rohit Sharma,ImRo45,690,"The birthday is finally here!The only person in the world who gets excited 364 days before her birthday,the countdown begins again tomorrow https://t.co/kAJDgg7rA6",2021-04-15 13:36:49.422994,2016-12-20 18:53:34+00:00,10109,[],2510,,Twitter for iPhone,None,None,None
811188444512677889,Rohit Sharma,ImRo45,1082,"4-0 😉! That's sweet, well played boys !",2021-04-15 13:36:49.422994,2016-12-20 12:36:10+00:00,8408,[],2510,,Twitter for iPhone,None,None,None
808589289978261508,Rohit Sharma,ImRo45,929,Can't believe it's been a year already! Never a dull moment with this one @ritssajdeh #MyHappiness https://t.co/OcpvOoe5Cv,2021-04-15 13:36:49.422994,2016-12-13 08:28:04+00:00,8407,"[{'text': 'MyHappiness', 'indices': [86, 98]}]",2510,,Twitter for iPhone,None,None,None
808284317394710529,Rohit Sharma,ImRo45,816,Happy birthday @YUVSTRONG12 my  Nostradamus who predicted I'd marry @ritssajdeh 9 years ago. May this year be the best one yet Brothaman https://t.co/8dN0OYN0nQ,2021-04-15 13:36:49.422994,2016-12-12 12:16:13+00:00,7501,[],2510,,Twitter for iPhone,None,None,None
808180970318807040,Rohit Sharma,ImRo45,905,Big big congratulations to the boys and support staff for clinching the series. Home season so far has been brilliant.,2021-04-15 13:36:49.422994,2016-12-12 05:25:33+00:00,7831,[],2510,,Twitter for iPhone,None,None,None
807490012824551424,Rohit Sharma,ImRo45,268,Many many happy returns @dhawal_kulkarni wishing you nothing but lots of success and happiness,2021-04-15 13:36:49.422994,2016-12-10 07:39:56+00:00,3223,[],2510,,Twitter for iPhone,None,None,None
806872919607570432,Rohit Sharma,ImRo45,189,"RT @DIESEL: Icons Unite. @RenzoRosso and @ImRo45 celebrate the beginning of a new era. 
#MIDiesel https://t.co/AoCzz8Q3JD",2021-04-15 13:36:49.422994,2016-12-08 14:47:49+00:00,0,"[{'text': 'MIDiesel', 'indices': [88, 97]}]",2510,,Twitter for iPhone,"Icons Unite. @RenzoRosso and @ImRo45 celebrate the beginning of a new era. 
#MIDiesel https://t.co/AoCzz8Q3JD",None,None
806465696116932608,Rohit Sharma,ImRo45,782,What?? Rahane now?? Whats with all the injuries. Kaun laga raha hai nazar team ko,2021-04-15 13:36:49.422994,2016-12-07 11:49:40+00:00,4942,[],2510,,Twitter for iPhone,None,None,None
806098648136372224,Rohit Sharma,ImRo45,219,Happy to know that now we can check whether we can drive or need a cab just by using CEAT Breath Analyzers!Do visit:https://t.co/TnO89KVpX5,2021-04-15 13:36:49.422994,2016-12-06 11:31:08+00:00,2169,[],2510,,Twitter for iPhone,None,None,None
806039510538653696,Rohit Sharma,ImRo45,641,Wish you a great birthday jaddu. Please tell the whole world your real age. They think your 28 😂😂😂@imjadeja,2021-04-15 13:36:49.422994,2016-12-06 07:36:09+00:00,5338,[],2510,,Twitter for iPhone,None,None,None
805653401522630656,Rohit Sharma,ImRo45,326,Many many happy returns partner @SDhawan25 have a great day 🎂 https://t.co/Y9yoqHt08w,2021-04-15 13:36:49.422994,2016-12-05 06:01:53+00:00,2893,[],2510,,Instagram,None,None,None
804659358642696192,Rohit Sharma,ImRo45,1244,Brotherman down! Best wishes to my older brother @YUVSTRONG12 ! All eyes on @ImZaheer now 😏 https://t.co/kYYyqSSCMc,2021-04-15 13:36:49.422994,2016-12-02 12:11:55+00:00,11134,[],2510,,Twitter for iPhone,None,None,None
804286770338668544,Rohit Sharma,ImRo45,128,RT @ritssajdeh: ❤️December❤️💃,2021-04-15 13:36:49.422994,2016-12-01 11:31:23+00:00,0,[],2510,,Twitter for iPhone,❤️December❤️💃,None,None
803543891261591552,Rohit Sharma,ImRo45,390,I'm at the @IMGReliance office and ready to take on your questions. Hop on to my Facebook page and join the #LiveWithHitman session #4pm https://t.co/S3mRkVHBIO,2021-04-15 13:36:49.422994,2016-11-29 10:19:27+00:00,5513,"[{'text': 'LiveWithHitman', 'indices': [108, 123]}, {'text': '4pm', 'indices': [132, 136]}]",2510,,Twitter for iPhone,None,None,None
803149105635606532,Rohit Sharma,ImRo45,271,"Hi guys, Live video chat tomorrow on my Facebook page. Go to the link below for details: https://t.co/ICVk3NiDje #LiveWithHitman",2021-04-15 13:36:49.422994,2016-11-28 08:10:43+00:00,2305,"[{'text': 'LiveWithHitman', 'indices': [113, 128]}]",2510,,Twitter for iPhone,None,None,None
802389949316145152,Rohit Sharma,ImRo45,1767,Remembering the real heroes who laid their life and saved Mumbai from the terror night #26/11 https://t.co/Oz5Ch7fS4H,2021-04-15 13:36:49.422994,2016-11-26 05:54:06+00:00,8811,[],2510,,Twitter for iPhone,None,None,None
801770039649169408,Rohit Sharma,ImRo45,336,Can't do without my @adidas ZNE hoodie #FindFocus https://t.co/Key1hgD1zN,2021-04-15 13:36:49.422994,2016-11-24 12:50:48+00:00,3920,"[{'text': 'FindFocus', 'indices': [39, 49]}]",2510,,Twitter for iPhone,None,None,None
801508148314079232,Rohit Sharma,ImRo45,368,#HomewardBound ✈️ https://t.co/uLEi8ckjGX,2021-04-15 13:36:49.422994,2016-11-23 19:30:08+00:00,4320,"[{'text': 'HomewardBound', 'indices': [0, 14]}]",2510,,Twitter for iPhone,None,None,None
800638923386986496,Rohit Sharma,ImRo45,978,Great victory Team India 🇮🇳 way to go. People in Vizag had their first taste of test victory. Many more to come,2021-04-15 13:36:49.422994,2016-11-21 09:56:09+00:00,7165,[],2510,,Twitter for iPhone,None,None,None
799685293435736064,Rohit Sharma,ImRo45,200,Your presence at the airport was truly felt by everyone around I'm sure 😏 https://t.co/NarMYVuBoJ,2021-04-15 13:36:49.422994,2016-11-18 18:46:46+00:00,1954,[],2510,,Twitter for iPhone,None,None,None
799018384088322062,Rohit Sharma,ImRo45,203,.@DGoughie I think both of us were pretty out of it at the time! Shame we didn't meet.Wish you a speedy recover too! https://t.co/ByzI0k5M9p,2021-04-15 13:36:49.422994,2016-11-16 22:36:42+00:00,2330,[],2510,,Twitter for iPhone,None,None,None
797763992752160768,Rohit Sharma,ImRo45,1340,#ThisDayThatYear #264 🙌✌️️,2021-04-15 13:36:49.422994,2016-11-13 11:32:12+00:00,6101,"[{'text': 'ThisDayThatYear', 'indices': [0, 16]}]",2510,,Twitter for iPhone,None,None,None
797094215025102848,Rohit Sharma,ImRo45,1546,All went well. Thank you for your good wishes. Can't wait to be back at it 🏃🏻 https://t.co/llKqRtc3LJ,2021-04-15 13:36:49.422994,2016-11-11 15:10:44+00:00,11712,[],2510,,Twitter for iPhone,None,None,None
795175653758947329,Rohit Sharma,ImRo45,969,"Test debut,the most special day in my career made even more special by receiving my Test cap from @sachin_rt #6Nov13 https://t.co/fBzfUMVAEh",2021-04-15 13:36:49.422994,2016-11-06 08:07:04+00:00,7899,"[{'text': '6Nov13', 'indices': [109, 116]}]",2510,,Twitter for iPhone,None,None,None
794860956073476096,Rohit Sharma,ImRo45,78,"RT @StoryPicker: 5th and 6th Nov. See you at Select City Walk, Saket! 🐶
https://t.co/qZruvEnQeE",2021-04-15 13:36:49.422994,2016-11-05 11:16:34+00:00,0,[],2510,,Twitter for iPhone,"5th and 6th Nov. See you at Select City Walk, Saket! 🐶
https://t.co/qZruvEnQeE",None,None
794587941133832193,Rohit Sharma,ImRo45,400,With the man himself #StanSmith &amp; this lad @RanveerOfficial https://t.co/JSb3uBgtX0,2021-04-15 13:36:49.422994,2016-11-04 17:11:42+00:00,4036,"[{'text': 'StanSmith', 'indices': [21, 31]}]",2510,,Twitter for iPhone,None,None,None
793888741945380864,Rohit Sharma,ImRo45,177,"RT @mipaltan: Congratulations @hardikpandya7 on his maiden Test call-up. Read more about his journey so far with #TeamIndia.
https://t.co/5…",2021-04-15 13:36:49.422994,2016-11-02 18:53:20+00:00,0,"[{'text': 'TeamIndia', 'indices': [113, 123]}]",2510,,Twitter for iPhone,"Congratulations @hardikpandya7 on his maiden Test call-up. Read more about his journey so far with #TeamIndia.
https://t.co/5hQOWUDbjf https://t.co/vwDc7EP6H9",None,None
793373169931395072,Rohit Sharma,ImRo45,202,Let's meet? #BeLikeHitman @adidascricket https://t.co/e6h0ElIUMY,2021-04-15 13:36:49.422994,2016-11-01 08:44:38+00:00,1744,"[{'text': 'BeLikeHitman', 'indices': [12, 25]}]",2510,,Twitter for iPhone,None,None,None
792647910282387456,Rohit Sharma,ImRo45,613,"Good 5 weeks of cricket played, look forward to some time with family and friends #ShubhDeepavli https://t.co/BqcjPpGGPm",2021-04-15 13:36:49.422994,2016-10-30 08:42:43+00:00,6820,"[{'text': 'ShubhDeepavli', 'indices': [82, 96]}]",2510,,Twitter for iPhone,None,None,None
792399513621331968,Rohit Sharma,ImRo45,1792,Special win on a special day with blessings from a special person in your life #BackOfTheJersey #Mom @BCCI https://t.co/wYg3XqloLI,2021-04-15 13:36:49.422994,2016-10-29 16:15:40+00:00,11424,"[{'text': 'BackOfTheJersey', 'indices': [79, 95]}, {'text': 'Mom', 'indices': [96, 100]}]",2510,,Twitter for iPhone,None,None,None
791925011896348672,Rohit Sharma,ImRo45,1561,"RT @BCCI: 'Our Jawans are the real Heroes' - @imVkohli, @ImRo45, @ajinkyarahane88 &amp; @ianuragthakur with PM @narendramodi #Sandesh2Soldiers…",2021-04-15 13:36:49.422994,2016-10-28 08:50:10+00:00,0,"[{'text': 'Sandesh2Soldiers', 'indices': [125, 142]}]",2510,,Twitter for iPhone,"'Our Jawans are the real Heroes' - @imVkohli, @ImRo45, @ajinkyarahane88 &amp; @ianuragthakur with PM @narendramodi #Sandesh2Soldiers https://t.co/LgErzFNR0z",None,None
789858475388002304,Rohit Sharma,ImRo45,331,RT @dhawal_kulkarni: World Champions at the Kabbadi Worldcup 2016..Well done team India..Made us proud @KabaddiIndia @ProKabaddi #2016Kabad…,2021-04-15 13:36:49.422994,2016-10-22 15:58:30+00:00,0,[],2510,,Twitter for iPhone,World Champions at the Kabbadi Worldcup 2016..Well done team India..Made us proud @KabaddiIndia @ProKabaddi #2016KabaddiWorldCup,None,None
789801240859406336,Rohit Sharma,ImRo45,395,Good luck to all the members of Indian Team for the #KabaddiWorldCupFinal2016 cricket team is rooting for you #ReadyToRaid,2021-04-15 13:36:49.422994,2016-10-22 12:11:04+00:00,2682,"[{'text': 'KabaddiWorldCupFinal2016', 'indices': [52, 77]}, {'text': 'ReadyToRaid', 'indices': [110, 122]}]",2510,,Twitter for iPhone,None,None,None
789707516817108992,Rohit Sharma,ImRo45,393,Proud to team up with 1 of the largest footwear manufacturers &amp; endorse their brand Walkaroo-a brand that stands for all walks of life #VKC https://t.co/oO5pl2RlP3,2021-04-15 13:36:49.422994,2016-10-22 05:58:38+00:00,5207,"[{'text': 'VKC', 'indices': [139, 143]}]",2510,,Twitter for iPhone,None,None,None
788736264262430720,Rohit Sharma,ImRo45,331,Evening well spent meeting the real heroes of India #JaiHind  https://t.co/JiaqMrezX9,2021-04-15 13:36:49.422994,2016-10-19 13:39:14+00:00,2553,"[{'text': 'JaiHind', 'indices': [52, 60]}]",2510,,Twitter for iPhone,None,None,None
786073022440566784,Rohit Sharma,ImRo45,650,#Number1 #TeamIndia #TestCricket🙏 https://t.co/VgIz86ueFR,2021-04-15 13:36:49.422994,2016-10-12 05:16:27+00:00,5281,"[{'text': 'Number1', 'indices': [0, 8]}, {'text': 'TeamIndia', 'indices': [9, 19]}, {'text': 'TestCricket', 'indices': [20, 32]}]",2510,,Twitter for iPhone,None,None,None
786072171810521089,Rohit Sharma,ImRo45,1108,Always been one of my dreams to be a part of the No 1 Test team.A feeling I'll cherish always.Great work team India https://t.co/UAIfl7gdxA,2021-04-15 13:36:49.422994,2016-10-12 05:13:04+00:00,9310,[],2510,,Twitter for iPhone,None,None,None
785489120663445505,Rohit Sharma,ImRo45,302,I'm ecstatic to hear the positive response my game has gotten so far. Thanks for the love guys! #RohitCricketChampionship @NazaraGames,2021-04-15 13:36:49.422994,2016-10-10 14:36:14+00:00,2604,"[{'text': 'RohitCricketChampionship', 'indices': [96, 121]}]",2510,,Twitter for iPhone,None,None,None
785485953741705216,Rohit Sharma,ImRo45,178,Glad you like the game. Keep hitting them out of the park @NazaraGames  https://t.co/aADej8Kz5z,2021-04-15 13:36:49.422994,2016-10-10 14:23:39+00:00,1549,[],2510,,Twitter for iPhone,None,None,None
783321746011107328,Rohit Sharma,ImRo45,325,Play Now https://t.co/2lshTmHUNh @NazaraGames https://t.co/ECvwg5jtup,2021-04-15 13:36:49.422994,2016-10-04 15:03:52+00:00,3034,[],2510,,Twitter for iPhone,None,None,None
783321644978823168,Rohit Sharma,ImRo45,600,The sound of my fans cheering at Eden gardens still oscillates in my ears. Replay my knock filled with 6's &amp; 4’s,2021-04-15 13:36:49.422994,2016-10-04 15:03:28+00:00,3790,[],2510,,Twitter for iPhone,None,None,None
782917854584856576,Rohit Sharma,ImRo45,625,Eden gardens 🙏🙏🙏,2021-04-15 13:36:49.422994,2016-10-03 12:18:57+00:00,3277,[],2510,,Twitter for iPhone,None,None,None
779689786567077888,Rohit Sharma,ImRo45,287,"#RohitCricketChampionship          https://t.co/2lshTmHUNh
 
Official trailer youtube link: https://t.co/I9gF666WQu https://t.co/wyGxUGcoLp",2021-04-15 13:36:49.422994,2016-09-24 14:31:45+00:00,1817,"[{'text': 'RohitCricketChampionship', 'indices': [0, 25]}]",2510,,Twitter for iPhone,None,None,None
779689444701908993,Rohit Sharma,ImRo45,279,So happy to be associated with @NazaraGames for my first ever cricket game #RohitCricketChampionship https://t.co/J4QZIpyuqS,2021-04-15 13:36:49.422994,2016-09-24 14:30:24+00:00,2411,"[{'text': 'RohitCricketChampionship', 'indices': [75, 100]}]",2510,,Twitter for iPhone,None,None,None
778604991573532672,Rohit Sharma,ImRo45,503,#500thTest Gala dinner 👏👏 @BCCI https://t.co/c8ZyR0ww0U,2021-04-15 13:36:49.422994,2016-09-21 14:41:10+00:00,4053,"[{'text': '500thTest', 'indices': [0, 10]}]",2510,,Twitter for iPhone,None,None,None
778591752852742144,Rohit Sharma,ImRo45,744,On the eve of the #500th Test I would like to congratulate all 285 players who helped us get here. Honoured to be a part of that @BCCI,2021-04-15 13:36:49.422994,2016-09-21 13:48:34+00:00,4640,"[{'text': '500th', 'indices': [18, 24]}]",2510,,Twitter for iPhone,None,None,None
776786967501549569,Rohit Sharma,ImRo45,605,Thank you to @BCCI for recommending and Thank you to Sports Authority of India for honouring #ArjunaAward2015,2021-04-15 13:36:49.422994,2016-09-16 14:16:59+00:00,3736,"[{'text': 'ArjunaAward2015', 'indices': [93, 109]}]",2510,,Twitter for iPhone,None,None,None
776780189070200832,Rohit Sharma,ImRo45,1268,Humbled to receive such a prestigious award. I will keep striving to achieve heights to make my country proud https://t.co/0WBSbzzT2N,2021-04-15 13:36:49.422994,2016-09-16 13:50:03+00:00,9852,[],2510,,Twitter for iPhone,None,None,None
775943454517923840,Rohit Sharma,ImRo45,1379,The greatest pleasure in life is doing what people say you cannot do 😊😊,2021-04-15 13:36:49.422994,2016-09-14 06:25:10+00:00,4124,[],2510,,Twitter for iPhone,None,None,None
772836748313460736,Rohit Sharma,ImRo45,481,Ganpati Bappa Morya 🙏🙏 https://t.co/PlLbWM6O11,2021-04-15 13:36:49.422994,2016-09-05 16:40:14+00:00,3949,[],2510,,Twitter for iPhone,None,None,None
772705352819347456,Rohit Sharma,ImRo45,333,Happy birthday to one of my dearest friends @pragyanojha Keep it spinning buddy! https://t.co/g9wwlNPQo8,2021-04-15 13:36:49.422994,2016-09-05 07:58:06+00:00,3907,[],2510,,Twitter for iPhone,None,None,None
772325702444126208,Rohit Sharma,ImRo45,785,"Not surprised with the response for @ABdeVilliers17 book. He's a world class player &amp; an even better human being. So humble, it's inspiring",2021-04-15 13:36:49.422994,2016-09-04 06:49:31+00:00,4269,[],2510,,Twitter for iPhone,None,None,None
772142741866381312,Rohit Sharma,ImRo45,784,"As usual @YUVSTRONG12 pulls out all the stops.Brilliant night.Great launch #DoItAgain no seriously, do it again man! https://t.co/gRtgJEuTrb",2021-04-15 13:36:49.422994,2016-09-03 18:42:30+00:00,6209,"[{'text': 'DoItAgain', 'indices': [75, 85]}]",2510,,Twitter for iPhone,None,None,None
771966881284681732,Rohit Sharma,ImRo45,259,Excited to be walking the ramp for the @YWCFashion launch with @YUVSTRONG12 tonight. Do check out their website https://t.co/P6TesdXGFQ,2021-04-15 13:36:49.422994,2016-09-03 07:03:41+00:00,1525,[],2510,,Twitter for iPhone,None,None,None
770114024939876352,Rohit Sharma,ImRo45,332,"Thrilled to watch this game grow &amp; be a part of it.Thank you to all the fans for coming out &amp; supporting us,you truly made it feel like home",2021-04-15 13:36:49.422994,2016-08-29 04:21:06+00:00,2448,[],2510,,Twitter Web Client,None,None,None
770110948048855041,Rohit Sharma,ImRo45,438,Rain played spoilsport today but what a great initiative to bring cricket to a non-cricketing country. Kudos to @BCCI for making this happen,2021-04-15 13:36:49.422994,2016-08-29 04:08:52+00:00,3261,[],2510,,Twitter for iPhone,None,None,None
768463242091958272,Rohit Sharma,ImRo45,217,Download or sign up to @sportconvo at https://t.co/ZPbxOnRFfW to get this video mag created by us players! #AlllOut https://t.co/8sOsJCz2Nb,2021-04-15 13:36:49.422994,2016-08-24 15:01:28+00:00,1598,"[{'text': 'AlllOut', 'indices': [107, 115]}]",2510,,Twitter for iPhone,None,None,None
768135060528652288,Rohit Sharma,ImRo45,574,Excited to be playing in the US for the first time. Florida here we come ✈️ @SDhawan25 #USAareYouReadyForUs https://t.co/8e9ARSjyqG,2021-04-15 13:36:49.422994,2016-08-23 17:17:24+00:00,5015,"[{'text': 'USAareYouReadyForUs', 'indices': [87, 107]}]",2510,,Twitter for iPhone,None,None,None
767372059240312832,Rohit Sharma,ImRo45,274,Thought I'd mix up my workout and try my hand at paddleboarding https://t.co/YNzRpnFbLR,2021-04-15 13:36:49.422994,2016-08-21 14:45:30+00:00,2449,[],2510,,Twitter for iPhone,None,None,None
767050173071577088,Rohit Sharma,ImRo45,202,But if we can guess what it's for then it wouldn't be a surprise 😳😳#PleaseDoItAgain @YUVSTRONG12 @harbhajan_singh  https://t.co/c2vpGALgqT,2021-04-15 13:36:49.422994,2016-08-20 17:26:27+00:00,1352,"[{'text': 'PleaseDoItAgain', 'indices': [67, 83]}]",2510,,Twitter for iPhone,None,None,None
765631432072896513,Rohit Sharma,ImRo45,145,🤔🤔🙃🙃 not sure  https://t.co/ezOUoS3eAe,2021-04-15 13:36:49.422994,2016-08-16 19:28:52+00:00,984,[],2510,,Twitter for iPhone,None,None,None
765611239955374082,Rohit Sharma,ImRo45,261,Buy the tickets now &amp; come watch Team India take on West Indies in its first ever series in the USA #TeamIndiaInUSA  https://t.co/Q3359lhjTg,2021-04-15 13:36:49.422994,2016-08-16 18:08:38+00:00,1450,"[{'text': 'TeamIndiaInUSA', 'indices': [104, 119]}]",2510,,Twitter for iPhone,None,None,None
765008673127084032,Rohit Sharma,ImRo45,961,Let's not take our independence for granted.Let's make this great nation even greater #HappyIndependenceDay #JaiHind https://t.co/qcPVXNfqj3,2021-04-15 13:36:49.422994,2016-08-15 02:14:15+00:00,5787,"[{'text': 'HappyIndependenceDay', 'indices': [86, 107]}, {'text': 'JaiHind', 'indices': [108, 116]}]",2510,,Twitter for iPhone,None,None,None
762303023171239938,Rohit Sharma,ImRo45,290,#TheCrew https://t.co/7Cyn77hsIA,2021-04-15 13:36:49.422994,2016-08-07 15:02:58+00:00,2271,"[{'text': 'TheCrew', 'indices': [0, 8]}]",2510,,Twitter for iPhone,None,None,None
762296865001922565,Rohit Sharma,ImRo45,311,"RT @BCCI: ""Go for gold,"" says @ImRo45 in his message to Indian athletes for #Rio2016 https://t.co/UcvEmsXZ7R",2021-04-15 13:36:49.422994,2016-08-07 14:38:30+00:00,0,"[{'text': 'Rio2016', 'indices': [76, 84]}]",2510,,Twitter for iPhone,"""Go for gold,"" says @ImRo45 in his message to Indian athletes for #Rio2016 https://t.co/UcvEmsXZ7R",None,None
761570786456940545,Rohit Sharma,ImRo45,455,Just heard about Nita bhabi being elected to the International Olympic Committee.True supporter of sports &amp;one of the most hardworking women,2021-04-15 13:36:49.422994,2016-08-05 14:33:19+00:00,3600,[],2510,,Twitter for iPhone,None,None,None
757953204718080001,Rohit Sharma,ImRo45,152,#Support a great cause @charitywater with my friends @graphicindia and their cool Indian comics on @humblebundle  https://t.co/PRVvYr2uv8,2021-04-15 13:36:49.422994,2016-07-26 14:58:20+00:00,942,"[{'text': 'Support', 'indices': [0, 8]}]",2510,,Twitter for iPhone,None,None,None
757756524798312448,Rohit Sharma,ImRo45,258,#KargilVijayDiwas #RealHeroes,2021-04-15 13:36:49.422994,2016-07-26 01:56:48+00:00,1166,"[{'text': 'KargilVijayDiwas', 'indices': [0, 17]}, {'text': 'RealHeroes', 'indices': [18, 29]}]",2510,,Twitter for iPhone,None,None,None
757756254223790080,Rohit Sharma,ImRo45,1364,Our flag does not move because the wind moved it. It flies with the breath of each soldiers who died protecting it. https://t.co/wnHpE36RQE,2021-04-15 13:36:49.422994,2016-07-26 01:55:44+00:00,6093,[],2510,,Twitter for iPhone,None,None,None
757603548171472896,Rohit Sharma,ImRo45,172,Day off = Netflix 🙌 #OfficiallyATVShowAddict https://t.co/EMG7ohYRSK,2021-04-15 13:36:49.422994,2016-07-25 15:48:56+00:00,1218,"[{'text': 'OfficiallyATVShowAddict', 'indices': [20, 44]}]",2510,,Twitter for iPhone,None,None,None
756071123889119232,Rohit Sharma,ImRo45,340,😍⛰🏝 https://t.co/iILyJcHvhY,2021-04-15 13:36:49.422994,2016-07-21 10:19:37+00:00,3159,[],2510,,Twitter for iPhone,None,None,None
754083903854436352,Rohit Sharma,ImRo45,162,Jeez what's happening in turkey now ??,2021-04-15 13:36:49.422994,2016-07-15 22:43:07+00:00,952,[],2510,,Twitter for iPhone,None,None,None
753924385627578368,Rohit Sharma,ImRo45,492,"Absolutely gutted to hear about the #NiceAttack I was there a few weeks ago, beautiful place, amazing people. Heart goes out....to everyone",2021-04-15 13:36:49.422994,2016-07-15 12:09:15+00:00,2413,"[{'text': 'NiceAttack', 'indices': [36, 47]}]",2510,,Twitter for iPhone,None,None,None
752855964261486593,Rohit Sharma,ImRo45,188,Rolling with the boys for an island visit ✌️✌#GoodTimes https://t.co/q8Mk9rfTDi,2021-04-15 13:36:49.422994,2016-07-12 13:23:43+00:00,1442,"[{'text': 'GoodTimes', 'indices': [45, 55]}]",2510,,Instagram,None,None,None
751008687452397569,Rohit Sharma,ImRo45,450,RT @mipaltan: A finisher par excellence &amp; a great leader! We wish MSD a very happy b'day. #DilSeIndian #HappyBirthdayCaptainCool https://t.…,2021-04-15 13:36:49.422994,2016-07-07 11:03:18+00:00,0,"[{'text': 'DilSeIndian', 'indices': [94, 106]}, {'text': 'HappyBirthdayCaptainCool', 'indices': [107, 132]}]",2510,,Twitter for iPhone,A finisher par excellence &amp; a great leader! We wish MSD a very happy b'day. #DilSeIndian #HappyBirthdayCaptainCool https://t.co/Tp3NJeh37V,None,None
750425773706776577,Rohit Sharma,ImRo45,171,And it begins ✈️✈️✌️✌ https://t.co/qKZi3lhFmB,2021-04-15 13:36:49.422994,2016-07-05 20:27:01+00:00,1060,[],2510,,Instagram,None,None,None
749443879007510528,Rohit Sharma,ImRo45,559,One of my favourites. Many many happy returns bhajju pa @harbhajan_singh https://t.co/6ic9PuzBXP,2021-04-15 13:36:49.422994,2016-07-03 03:25:19+00:00,4174,[],2510,,Twitter for iPhone,None,None,None
747751754436124672,Rohit Sharma,ImRo45,128,#SquadGoals @troycosta @colstonjulian1 @ritssajdeh https://t.co/xAaCjBmGPC,2021-04-15 13:36:49.422994,2016-06-28 11:21:25+00:00,838,"[{'text': 'SquadGoals', 'indices': [0, 11]}]",2510,,Instagram,None,None,None
747462777174786048,Rohit Sharma,ImRo45,263,Hala Espana #Euro2016 #FirstNeverFollows @adidas https://t.co/cYCQuxhXVU,2021-04-15 13:36:49.422994,2016-06-27 16:13:07+00:00,2190,"[{'text': 'Euro2016', 'indices': [12, 21]}, {'text': 'FirstNeverFollows', 'indices': [22, 40]}]",2510,,Twitter for iPhone,None,None,None
746600696007385088,Rohit Sharma,ImRo45,260,Follow @hypertygers IG &amp; share your photos being environment friendly using #GreenTyger to win a hat signed by me. https://t.co/s1zZlT4oLO,2021-04-15 13:36:49.422994,2016-06-25 07:07:31+00:00,2372,"[{'text': 'GreenTyger', 'indices': [80, 91]}]",2510,,Twitter for iPhone,None,None,None
746272513622155265,Rohit Sharma,ImRo45,461,"Congratulations Anil bhai, look forward taking Team India to the next level @anilkumble1074",2021-04-15 13:36:49.422994,2016-06-24 09:23:26+00:00,2286,[],2510,,Twitter for iPhone,None,None,None
745935006258839553,Rohit Sharma,ImRo45,264,At my happy place @adidas https://t.co/12Cq7qsoyO,2021-04-15 13:36:49.422994,2016-06-23 11:02:18+00:00,2153,[],2510,,Twitter for iPhone,None,None,None
744551977556774912,Rohit Sharma,ImRo45,2307,Welcome to the club @ImIshant congratulations you two. Lekin aaj ke din toh baal katva leta bhai 😂 https://t.co/yDEE4GhhBf,2021-04-15 13:36:49.422994,2016-06-19 15:26:39+00:00,11062,[],2510,,Twitter for iPhone,None,None,None
743868163494912000,Rohit Sharma,ImRo45,795,I agree 😆😅😂😂 @dhawal_kulkarni @ajinkyarahane88 https://t.co/WZfXLKOAJ1,2021-04-15 13:36:49.422994,2016-06-17 18:09:25+00:00,4356,[],2510,,Twitter for iPhone,None,None,None
