tweet_id,name,screen_name,retweet_count,text,mined_at,created_at,favourite_count,hashtags,status_count,location,source_device,retweet_text,quote_text,quote_screen_name
841434921113546753,Sundar Pichai,sundarpichai,263,Wishing everyone a very happy #Holi! https://t.co/37IuUAstU1,2021-04-15 13:08:09.447101,2017-03-13 23:44:52+00:00,2009,"[{'text': 'Holi', 'indices': [30, 35]}]",1519,,Twitter for Android,None,None,None
840312585094291456,Sundar Pichai,sundarpichai,113,"Thanks to the 10,000 customers, partners &amp; devs who joined us at #googlenext17 - can't wait to see what you build with us https://t.co/ShHvmF2f8M",2021-04-15 13:08:09.447101,2017-03-10 21:25:07+00:00,558,"[{'text': 'googlenext17', 'indices': [69, 82]}]",1519,,Twitter for Android,None,None,None
839707311476113408,Sundar Pichai,sundarpichai,14,"@NateSilver538 not sure is rational betting, 4 down in UCL ,no away goal against a quality team does not seem like 7-10%. Great game though!",2021-04-15 13:08:09.447101,2017-03-09 05:19:58+00:00,99,[],1519,,Twitter Web Client,None,None,None
839519289308655616,Sundar Pichai,sundarpichai,150,Excited to be at #GoogleNext17 - see you soon on the livestream https://t.co/FVsPD39dtv https://t.co/PSw3nHqjMB,2021-04-15 13:08:09.447101,2017-03-08 16:52:50+00:00,615,"[{'text': 'GoogleNext17', 'indices': [17, 30]}]",1519,,Twitter for Android,None,None,None
839504954435907584,Sundar Pichai,sundarpichai,205,We're proud to honor amazing women pioneers and committed to supporting women everywhere #InternationalWomensDay  https://t.co/klnnb30pzx,2021-04-15 13:08:09.447101,2017-03-08 15:55:53+00:00,838,"[{'text': 'InternationalWomensDay', 'indices': [89, 112]}]",1519,,Twitter for Android,None,None,None
837427045709705217,Sundar Pichai,sundarpichai,279,RT @claybavor: This is the very first Google Cardboard prototype. 10 million followed. https://t.co/8YayRtYx8s,2021-04-15 13:08:09.447101,2017-03-02 22:19:00+00:00,0,[],1519,,Twitter Web Client,This is the very first Google Cardboard prototype. 10 million followed. https://t.co/8YayRtYx8s,None,None
837399595630002177,Sundar Pichai,sundarpichai,267,Google Assistant rolling out to more @Android phones starting today! https://t.co/bx4UmImqbC,2021-04-15 13:08:09.447101,2017-03-02 20:29:56+00:00,848,[],1519,,Twitter Web Client,None,None,None
837124235990487040,Sundar Pichai,sundarpichai,34,RT @mhbergen: I took a walk around #mwc17 with Mr. @lockheimer https://t.co/Wb09yqWLuT,2021-04-15 13:08:09.447101,2017-03-02 02:15:45+00:00,0,"[{'text': 'mwc17', 'indices': [35, 41]}]",1519,,Twitter Web Client,I took a walk around #mwc17 with Mr. @lockheimer https://t.co/Wb09yqWLuT,None,None
837104306708856833,Sundar Pichai,sundarpichai,567,Also played hooky &amp; visited @FCBarcelona while in BCN. Big thanks @jmbartomeu for hosting me &amp; fulfilling a lifelong dream! https://t.co/cqWlTUZw8I,2021-04-15 13:08:09.447101,2017-03-02 00:56:34+00:00,2806,[],1519,"Place(_api=<tweepy.api.API object at 0x00000260A2B20E88>, id='b19a2cc5134b7e0a', url='https://api.twitter.com/1.1/geo/id/b19a2cc5134b7e0a.json', place_type='city', name='Mountain View', full_name='Mountain View, CA', country_code='US', country='United States', contained_within=[], bounding_box=BoundingBox(_api=<tweepy.api.API object at 0x00000260A2B20E88>, type='Polygon', coordinates=[[[-122.117916, 37.3567709], [-122.044969, 37.3567709], [-122.044969, 37.436935], [-122.117916, 37.436935]]]), attributes={})",Twitter Web Client,None,None,None
837101344838172672,Sundar Pichai,sundarpichai,93,Whirlwind trip to Barcelona for #MWC17 this week - always a fun and productive event for our partners and teams https://t.co/BqGzuY0IEx,2021-04-15 13:08:09.447101,2017-03-02 00:44:47+00:00,852,"[{'text': 'MWC17', 'indices': [32, 38]}]",1519,"Place(_api=<tweepy.api.API object at 0x00000260A2B20E88>, id='b19a2cc5134b7e0a', url='https://api.twitter.com/1.1/geo/id/b19a2cc5134b7e0a.json', place_type='city', name='Mountain View', full_name='Mountain View, CA', country_code='US', country='United States', contained_within=[], bounding_box=BoundingBox(_api=<tweepy.api.API object at 0x00000260A2B20E88>, type='Polygon', coordinates=[[[-122.117916, 37.3567709], [-122.044969, 37.3567709], [-122.044969, 37.436935], [-122.117916, 37.436935]]]), attributes={})",Twitter Web Client,None,None,None
831953330918207488,Sundar Pichai,sundarpichai,233,"Can't wait to see what developers around the world will build w/ @TensorFlow. Thx for tuning in, Lagos! #TFDevSummit https://t.co/34jNqQMPiA https://t.co/973ef2OvMK",2021-04-15 13:08:09.447101,2017-02-15 19:48:25+00:00,824,"[{'text': 'TFDevSummit', 'indices': [104, 116]}]",1519,,Twitter Web Client,None,None,None
830232501373132800,Sundar Pichai,sundarpichai,629,So inspired by Nji's story &amp; look forward to welcoming him and all the winners to the Googleplex https://t.co/G5dMGDO8JF,2021-04-15 13:08:09.447101,2017-02-11 01:50:27+00:00,1468,[],1519,,Twitter for Android,None,None,None
828875923944464384,Sundar Pichai,sundarpichai,202,RT @googleresearch: Can a combination of machine learning and crowdsourcing help with parking woes? Find out at https://t.co/WY1XTLK9UJ htt…,2021-04-15 13:08:09.447101,2017-02-07 07:59:54+00:00,0,[],1519,,Twitter for Android,Can a combination of machine learning and crowdsourcing help with parking woes? Find out at https://t.co/WY1XTLK9UJ https://t.co/muZmgVKE0A,None,None
828461642924961792,Sundar Pichai,sundarpichai,109,I think I can play atleast one kind of football as well as @LuisSuarez9 and @FCBarcelona https://t.co/AArzinxw1H,2021-04-15 13:08:09.447101,2017-02-06 04:33:42+00:00,651,[],1519,,Twitter Web Client,None,None,None
828457493068013568,Sundar Pichai,sundarpichai,236,Worth remembering @AtlantaFalcons  only had a ~1.4% chance of making the superbowl when the season started!,2021-04-15 13:08:09.447101,2017-02-06 04:17:13+00:00,1104,[],1519,,Twitter Web Client,None,None,None
825569430507622402,Sundar Pichai,sundarpichai,3100,"For generations, this country has been home to immigrants like Sanaz. Her story is playing out all over the country. Google is with you. https://t.co/mllnZ5gNDB",2021-04-15 13:08:09.447101,2017-01-29 05:01:05+00:00,5944,[],1519,,Twitter Web Client,None,None,None
824700056963948545,Sundar Pichai,sundarpichai,863,"Yep, it's true: I/O'17 will be at Shoreline Amphitheatre in Mountain View, CA on May 17-19. See you in 110 days :) #io17 https://t.co/vVlvx1N5mJ",2021-04-15 13:08:09.447101,2017-01-26 19:26:30+00:00,2224,"[{'text': 'io17', 'indices': [115, 120]}]",1519,"Place(_api=<tweepy.api.API object at 0x00000260A2B20E88>, id='b19a2cc5134b7e0a', url='https://api.twitter.com/1.1/geo/id/b19a2cc5134b7e0a.json', place_type='city', name='Mountain View', full_name='Mountain View, CA', country_code='US', country='United States', contained_within=[], bounding_box=BoundingBox(_api=<tweepy.api.API object at 0x00000260A2B20E88>, type='Polygon', coordinates=[[[-122.117916, 37.3567709], [-122.044969, 37.3567709], [-122.044969, 37.436935], [-122.117916, 37.436935]]]), attributes={})",Twitter Web Client,None,None,None
823559152563666944,Sundar Pichai,sundarpichai,545,RT @PranavDixit: Actual Google spokesperson response to question about whether Google is buying Conde Nast. Someone really loves their job!…,2021-04-15 13:08:09.447101,2017-01-23 15:52:57+00:00,0,[],1519,,Twitter for Android,Actual Google spokesperson response to question about whether Google is buying Conde Nast. Someone really loves their job! https://t.co/Wrp8mDsUPT,None,None
821062854790942722,Sundar Pichai,sundarpichai,595,"""We cannot walk alone. And as we walk, we must make the pledge that we shall always march ahead. We cannot turn back."" - MLK Jr. https://t.co/ww13XwXITv",2021-04-15 13:08:09.447101,2017-01-16 18:33:33+00:00,1924,[],1519,,Twitter for Android,None,None,None
819792132227481600,Sundar Pichai,sundarpichai,324,"RT @googleresearch: The Google Brain team (https://t.co/6BSGMMfnll) takes a look back on an exciting 2016, at https://t.co/Q1Rw0chKtT",2021-04-15 13:08:09.447101,2017-01-13 06:24:09+00:00,0,[],1519,,Twitter Web Client,"The Google Brain team (https://t.co/6BSGMMfnll) takes a look back on an exciting 2016, at https://t.co/Q1Rw0chKtT",None,None
818681100281073664,Sundar Pichai,sundarpichai,2299,RT @BillGates: There’s a lot to be optimistic about in 2017…life is getting better for more people on our planet. Especially here. https://…,2021-04-15 13:08:09.447101,2017-01-10 04:49:19+00:00,0,[],1519,,Twitter for Android,There’s a lot to be optimistic about in 2017…life is getting better for more people on our planet. Especially here. https://t.co/USIqdKHdAR,None,None
817645586652352513,Sundar Pichai,sundarpichai,1377,Also got to visit my alma mater (and old dorm room!) for the first time in 23 years. Thanks to everyone @IITKgp for the warm welcome! https://t.co/OUn7mlKGI7,2021-04-15 13:08:09.447101,2017-01-07 08:14:33+00:00,5730,[],1519,,Twitter for Android,None,None,None
817644019647811584,Sundar Pichai,sundarpichai,675,"Spent this past week in India: so proud of our many initiatives to bring digital skills training, tools and wifi to everyone in the country https://t.co/Thytf8V795",2021-04-15 13:08:09.447101,2017-01-07 08:08:20+00:00,3472,[],1519,,Twitter for Android,None,None,None
817171449391808513,Sundar Pichai,sundarpichai,327,"RT @Android: News from #CES2017: Google Assistant is coming soon to your #AndroidTV. Happy watching! 📺 #AndroidEverywhere
https://t.co/tjId…",2021-04-15 13:08:09.447101,2017-01-06 00:50:30+00:00,0,"[{'text': 'CES2017', 'indices': [23, 31]}, {'text': 'AndroidTV', 'indices': [73, 83]}, {'text': 'AndroidEverywhere', 'indices': [103, 121]}]",1519,,Twitter for Android,"News from #CES2017: Google Assistant is coming soon to your #AndroidTV. Happy watching! 📺 #AndroidEverywhere
https://t.co/tjIdjen16t https://t.co/Pq5b5FweIE",None,None
815423626908405760,Sundar Pichai,sundarpichai,361,Wish everyone a great 2017 ahead - Happy New Year:),2021-04-15 13:08:09.447101,2017-01-01 05:05:17+00:00,3073,[],1519,,Twitter for Android,None,None,None
809281631559172096,Sundar Pichai,sundarpichai,256,Lots more work to be done but very proud of the team's progress https://t.co/GWXoJIP1KB,2021-04-15 13:08:09.447101,2016-12-15 06:19:11+00:00,795,[],1519,,Twitter for Android,None,None,None
809209229701545984,Sundar Pichai,sundarpichai,154,"As the year wraps up, we look back at what mattered to the world https://t.co/PfFQPJ8Q6q",2021-04-15 13:08:09.447101,2016-12-15 01:31:29+00:00,559,[],1519,,Twitter for Android,None,None,None
806921906087596033,Sundar Pichai,sundarpichai,698,"RT @googledevs: Starting today, developers can build for the Google Assistant! Learn more at https://t.co/G1In1efozV #ActionsOnGoogle https…",2021-04-15 13:08:09.447101,2016-12-08 18:02:28+00:00,0,"[{'text': 'ActionsOnGoogle', 'indices': [117, 133]}]",1519,,Twitter for Android,"Starting today, developers can build for the Google Assistant! Learn more at https://t.co/G1In1efozV #ActionsOnGoogle https://t.co/9t8uzmBLuR",None,None
806140980659265536,Sundar Pichai,sundarpichai,1320,"So proud Google will reach 100% renewable energy in 2017, minimizing environmental impact + supporting clean energy https://t.co/SiLusbFMct",2021-04-15 13:08:09.447101,2016-12-06 14:19:21+00:00,3010,[],1519,,Twitter for Android,None,None,None
805177965201920000,Sundar Pichai,sundarpichai,1607,RT @Athletics: Our thoughts are with everyone affected by the #OaklandFire. We are Oakland. Donate to help. https://t.co/dtVUflIQNp https:/…,2021-04-15 13:08:09.447101,2016-12-03 22:32:41+00:00,0,"[{'text': 'OaklandFire', 'indices': [62, 74]}]",1519,,Twitter for Android,Our thoughts are with everyone affected by the #OaklandFire. We are Oakland. Donate to help. https://t.co/dtVUflIQNp https://t.co/u0qnxfmocb,None,None
805100882262007808,Sundar Pichai,sundarpichai,128,"As always one of the great sporting moments of the year, great game #elclasico https://t.co/t6zZ4kA7KN",2021-04-15 13:08:09.447101,2016-12-03 17:26:23+00:00,709,"[{'text': 'elclasico', 'indices': [68, 78]}]",1519,,Twitter for Android,None,None,None
804729713386102784,Sundar Pichai,sundarpichai,38,RT @claybavor: Pssst. Daydream View in snow and crimson... now available for pre-order. https://t.co/rE5lAxBCZV https://t.co/SOipX2IJn6,2021-04-15 13:08:09.447101,2016-12-02 16:51:29+00:00,0,[],1519,,Twitter for Android,Pssst. Daydream View in snow and crimson... now available for pre-order. https://t.co/rE5lAxBCZV https://t.co/SOipX2IJn6,None,None
804547093939400704,Sundar Pichai,sundarpichai,4,@kcoleman wish you the best Keith!,2021-04-15 13:08:09.447101,2016-12-02 04:45:49+00:00,55,[],1519,,Twitter for Android,None,None,None
804540565228376064,Sundar Pichai,sundarpichai,134,"RT @timoreilly: Good interview with Google's Jeff Dean about reinforcement learning and other #AI techniques    
https://t.co/7vsObQVhKt",2021-04-15 13:08:09.447101,2016-12-02 04:19:53+00:00,0,"[{'text': 'AI', 'indices': [94, 97]}]",1519,,Twitter for Android,"Good interview with Google's Jeff Dean about reinforcement learning and other #AI techniques    
https://t.co/7vsObQVhKt",None,None
804467860764377088,Sundar Pichai,sundarpichai,625,"RT @googleresearch: Three quadrillion pixels later, meet the new #EarthTimelapse, our most detailed view of Earth across space and time: ht…",2021-04-15 13:08:09.447101,2016-12-01 23:30:58+00:00,0,"[{'text': 'EarthTimelapse', 'indices': [65, 80]}]",1519,,Twitter Web Client,"Three quadrillion pixels later, meet the new #EarthTimelapse, our most detailed view of Earth across space and time: https://t.co/jgbKhTLy39 https://t.co/yvhfBi6m0m",None,None
803632603286773761,Sundar Pichai,sundarpichai,454,Spoke about this at I/O: today we're publishing our results of using machine learning to detect diabetic retinopathy https://t.co/k7oWRO04cK,2021-04-15 13:08:09.447101,2016-11-29 16:11:58+00:00,926,[],1519,,Twitter for Android,None,None,None
803442613089026048,Sundar Pichai,sundarpichai,151,RT @engadget: Google's AI can translate language pairs it has never seen https://t.co/LySsixwFVh https://t.co/1kSIaEdFbl,2021-04-15 13:08:09.447101,2016-11-29 03:37:00+00:00,0,[],1519,,Twitter for Android,Google's AI can translate language pairs it has never seen https://t.co/LySsixwFVh https://t.co/1kSIaEdFbl,None,None
799227731946995712,Sundar Pichai,sundarpichai,309,"Great discussions on AI, and the importance of digital skills training at the National IT Summit in Germany #itg16 https://t.co/UYgGomUUbY",2021-04-15 13:08:09.447101,2016-11-17 12:28:34+00:00,1086,"[{'text': 'itg16', 'indices': [108, 114]}]",1519,"Place(_api=<tweepy.api.API object at 0x00000260A2B20E88>, id='0c3ccd897a53b270', url='https://api.twitter.com/1.1/geo/id/0c3ccd897a53b270.json', place_type='city', name='Saarbrücken', full_name='Saarbrücken, Germany', country_code='DE', country='Germany', contained_within=[], bounding_box=BoundingBox(_api=<tweepy.api.API object at 0x00000260A2B20E88>, type='Polygon', coordinates=[[[6.8274592, 49.165076], [7.138098, 49.165076], [7.138098, 49.322051], [6.8274592, 49.322051]]]), attributes={})",Twitter Web Client,None,None,None
798879825968635904,Sundar Pichai,sundarpichai,893,"Using machine learning, #GoogleTranslate is improving more in a single leap than we’ve seen in the last 10 years combined https://t.co/YPS0H7bFxy",2021-04-15 13:08:09.447101,2016-11-16 13:26:07+00:00,1537,"[{'text': 'GoogleTranslate', 'indices': [24, 40]}]",1519,,Twitter Web Client,None,None,None
798703633080717312,Sundar Pichai,sundarpichai,162,"Exciting machine learning developments in @GoogleCloud Platform, and a warm welcome to @drfeifei &amp; @lijiali_vision! https://t.co/7BoetHPpvh",2021-04-15 13:08:09.447101,2016-11-16 01:45:59+00:00,431,[],1519,,Twitter Web Client,None,None,None
798682683232649216,Sundar Pichai,sundarpichai,128,"Love that machine learning can improve your music playlists, too https://t.co/beGfBJpGS9",2021-04-15 13:08:09.447101,2016-11-16 00:22:45+00:00,471,[],1519,,Twitter Web Client,None,None,None
798615400779026432,Sundar Pichai,sundarpichai,64,"Great to have you visit Google London, @SadiqKhan https://t.co/BMfmgLuYjH",2021-04-15 13:08:09.447101,2016-11-15 19:55:23+00:00,299,[],1519,,Twitter for Android,None,None,None
798582180804857856,Sundar Pichai,sundarpichai,113,RT @GoogleUK: Great morning at Argyle Primary School visiting Space through Google Expeditions -  excited we are bringing VR to 1 million U…,2021-04-15 13:08:09.447101,2016-11-15 17:43:23+00:00,0,[],1519,,Twitter for Android,Great morning at Argyle Primary School visiting Space through Google Expeditions -  excited we are bringing VR to 1 million UK pupils https://t.co/Tn134Re5yU,None,None
798235415434166272,Sundar Pichai,sundarpichai,88,Hello from London! So great to meet with our teams here in the UK https://t.co/jMRWBWY1Ga,2021-04-15 13:08:09.447101,2016-11-14 18:45:28+00:00,852,[],1519,"Place(_api=<tweepy.api.API object at 0x00000260A2B20E88>, id='5d838f7a011f4a2d', url='https://api.twitter.com/1.1/geo/id/5d838f7a011f4a2d.json', place_type='admin', name='London', full_name='London, England', country_code='GB', country='United Kingdom', contained_within=[], bounding_box=BoundingBox(_api=<tweepy.api.API object at 0x00000260A2B20E88>, type='Polygon', coordinates=[[[-0.510364798739281, 51.2867019756122], [0.334043461659515, 51.2867019756122], [0.334043461659515, 51.6918240878432], [-0.510364798739281, 51.6918240878432]]]), attributes={})",Twitter Web Client,None,None,None
797131797091885058,Sundar Pichai,sundarpichai,61,Thank you to all veterans who have served our country https://t.co/5BrDaPj06n,2021-04-15 13:08:09.447101,2016-11-11 17:40:05+00:00,434,[],1519,,Twitter for Android,None,None,None
797125014642266112,Sundar Pichai,sundarpichai,54,"Thanks for joining us, PM @LeeHsienLoong! https://t.co/yozb2lf1pH",2021-04-15 13:08:09.447101,2016-11-11 17:13:08+00:00,275,[],1519,,Twitter for Android,None,None,None
796126579524976640,Sundar Pichai,sundarpichai,327,"After polls close tonight, you'll be able to see election results directly in Google Search across 30 languages https://t.co/lOLiqf9NUh",2021-04-15 13:08:09.447101,2016-11-08 23:05:42+00:00,882,[],1519,,Twitter for Android,None,None,None
796020961707368449,Sundar Pichai,sundarpichai,193,"RT @google: If you're in one of these states, it’s not too late to register to vote today. https://t.co/mpBNeqwzcu #ElectionDay https://t.c…",2021-04-15 13:08:09.447101,2016-11-08 16:06:01+00:00,0,"[{'text': 'ElectionDay', 'indices': [115, 127]}]",1519,,Twitter for Android,"If you're in one of these states, it’s not too late to register to vote today. https://t.co/mpBNeqwzcu #ElectionDay https://t.co/U83KavzNh9",None,None
795883435013246976,Sundar Pichai,sundarpichai,183,"RT @Uber: Every vote counts, so make sure to cast yours. With @Google, we're making it easy to find your polling place. https://t.co/DaFvMG…",2021-04-15 13:08:09.447101,2016-11-08 06:59:32+00:00,0,[],1519,,Twitter for Android,"Every vote counts, so make sure to cast yours. With @Google, we're making it easy to find your polling place. https://t.co/DaFvMG58CD https://t.co/segBstKgvc",None,None
795741634944122882,Sundar Pichai,sundarpichai,133,RT @claybavor: Daydream View hits the shelves on Thursday (and the Googleplex shelves today!) https://t.co/LywDLcDmSJ,2021-04-15 13:08:09.447101,2016-11-07 21:36:04+00:00,0,[],1519,,Twitter for Android,Daydream View hits the shelves on Thursday (and the Googleplex shelves today!) https://t.co/LywDLcDmSJ,None,None
795738675564843008,Sundar Pichai,sundarpichai,560,RT @google: Your voice matters. Your vote counts. Find your polling place and go vote tomorrow! https://t.co/cEJLFFIeBS https://t.co/z54JHF…,2021-04-15 13:08:09.447101,2016-11-07 21:24:19+00:00,0,[],1519,,Twitter for Android,Your voice matters. Your vote counts. Find your polling place and go vote tomorrow! https://t.co/cEJLFFIeBS https://t.co/z54JHFKMQu,None,None
795402170120028161,Sundar Pichai,sundarpichai,421,"RT @demishassabis: #AlphaGo update: we've been hard at work improving AG, delighted to announce that more games will be played in early 201…",2021-04-15 13:08:09.447101,2016-11-06 23:07:09+00:00,0,"[{'text': 'AlphaGo', 'indices': [19, 27]}]",1519,,Twitter Web Client,"#AlphaGo update: we've been hard at work improving AG, delighted to announce that more games will be played in early 2017! More details soon",None,None
788898406345289728,Sundar Pichai,sundarpichai,96,Great day in DC yesterday meeting &amp; chatting with Googlers - thanks @VGCerf for hosting! https://t.co/ZlCghc83XK,2021-04-15 13:08:09.447101,2016-10-20 00:23:31+00:00,699,[],1519,,Twitter Web Client,None,None,None
788809645494153216,Sundar Pichai,sundarpichai,115,RT @chr1sa: Google has open sourced more projects than I knew (20 million lines of code):  Google Open Source Report Card https://t.co/YZC4…,2021-04-15 13:08:09.447101,2016-10-19 18:30:49+00:00,0,[],1519,,Twitter Web Client,Google has open sourced more projects than I knew (20 million lines of code):  Google Open Source Report Card https://t.co/YZC48rB2Ac,None,None
788808369171640320,Sundar Pichai,sundarpichai,79,"Congrats to Anna Patterson on your Technical Leadership #ABIEAward - we @Google are very proud of you! #ghc16
https://t.co/Z3NrjeBqkd",2021-04-15 13:08:09.447101,2016-10-19 18:25:45+00:00,401,"[{'text': 'ABIEAward', 'indices': [56, 66]}, {'text': 'ghc16', 'indices': [103, 109]}]",1519,,Twitter Web Client,None,None,None
788202451165847553,Sundar Pichai,sundarpichai,8,@waltmossberg @WSJ @verge congrats Walt!,2021-04-15 13:08:09.447101,2016-10-18 02:18:03+00:00,92,[],1519,,Twitter Web Client,None,None,None
787881863322841088,Sundar Pichai,sundarpichai,184,RT @TheSimpsons: The @Google VR experience is here and it’s going to be excelleeent! #TheSimpsons #GoogleCardboard #SpotlightStories: https…,2021-04-15 13:08:09.447101,2016-10-17 05:04:09+00:00,0,"[{'text': 'TheSimpsons', 'indices': [85, 97]}, {'text': 'GoogleCardboard', 'indices': [98, 114]}, {'text': 'SpotlightStories', 'indices': [115, 132]}]",1519,,Twitter Web Client,The @Google VR experience is here and it’s going to be excelleeent! #TheSimpsons #GoogleCardboard #SpotlightStories: https://t.co/v80w61fzjy https://t.co/e6axqvQQlA,None,None
787398428565180416,Sundar Pichai,sundarpichai,174,"Am a bit shocked that so many countries came together to get this done, should have big impact! #kigali    https://t.co/wB0RscJhPg",2021-04-15 13:08:09.447101,2016-10-15 21:03:09+00:00,522,"[{'text': 'kigali', 'indices': [96, 103]}]",1519,,Twitter Web Client,None,None,None
786585438802759680,Sundar Pichai,sundarpichai,9,@om glad it was another moment to remember and celebrate him,2021-04-15 13:08:09.447101,2016-10-13 15:12:37+00:00,67,[],1519,,Twitter for Android,None,None,None
786445836557230080,Sundar Pichai,sundarpichai,127,Exciting work by @DeepMindAI team on differentiable neural computers https://t.co/43628Z9MJK,2021-04-15 13:08:09.447101,2016-10-13 05:57:53+00:00,324,[],1519,,Twitter for Android,None,None,None
786404877689757696,Sundar Pichai,sundarpichai,661,"Thank you for your immense contributions, RIP Dennis Ritchie https://t.co/LVacgkcXvl",2021-04-15 13:08:09.447101,2016-10-13 03:15:08+00:00,892,[],1519,,Twitter for Android,None,None,None
785964648163971072,Sundar Pichai,sundarpichai,69,Don't forget to register to vote! https://t.co/pQe4buerHe,2021-04-15 13:08:09.447101,2016-10-11 22:05:49+00:00,228,[],1519,,Twitter Web Client,None,None,None
785927573788254208,Sundar Pichai,sundarpichai,72,"Inspiring post to read, lets celebrate #Dayofthegirl https://t.co/XbeJ3v5ppJ",2021-04-15 13:08:09.447101,2016-10-11 19:38:30+00:00,247,"[{'text': 'Dayofthegirl', 'indices': [39, 52]}]",1519,,Twitter Web Client,None,None,None
785689333890101249,Sundar Pichai,sundarpichai,481,"RT @BenedictEvans: Some time this summer, the 20 billionth mobile phone was sold. By the end of the year, the 5 billionth PC may have been…",2021-04-15 13:08:09.447101,2016-10-11 03:51:49+00:00,0,[],1519,,Twitter Web Client,"Some time this summer, the 20 billionth mobile phone was sold. By the end of the year, the 5 billionth PC may have been sold.",None,None
783799114274181120,Sundar Pichai,sundarpichai,481,RT @google: #ItTakesATeacher to prepare the leaders of tomorrow. Let's celebrate them on #WorldTeachersDay. https://t.co/FPIFXGqWyt https:/…,2021-04-15 13:08:09.447101,2016-10-05 22:40:45+00:00,0,"[{'text': 'ItTakesATeacher', 'indices': [12, 28]}, {'text': 'WorldTeachersDay', 'indices': [89, 106]}]",1519,,Twitter for Android,#ItTakesATeacher to prepare the leaders of tomorrow. Let's celebrate them on #WorldTeachersDay. https://t.co/FPIFXGqWyt https://t.co/38zLaTPKHv,None,None
783400184411672576,Sundar Pichai,sundarpichai,432,"We are excited about building a personal Google for everyone, everywhere https://t.co/iqPsC0eYkX",2021-04-15 13:08:09.447101,2016-10-04 20:15:33+00:00,1016,[],1519,,Twitter for Android,None,None,None
783329610393989120,Sundar Pichai,sundarpichai,665,"OK Google, set a timer for 25 minutes - see you on the livestream at 9am PT! https://t.co/0PPLcgGujg #madebyGoogle",2021-04-15 13:08:09.447101,2016-10-04 15:35:07+00:00,1571,"[{'text': 'madebyGoogle', 'indices': [101, 114]}]",1519,,Twitter Web Client,None,None,None
780892157523533824,Sundar Pichai,sundarpichai,423,So inspired by all the young scientists I met today at #GoogleScienceFair - congrats to all the winners &amp; finalists! https://t.co/0UaIORn6vl https://t.co/SvctfrUvJ2,2021-04-15 13:08:09.447101,2016-09-27 22:09:33+00:00,1888,"[{'text': 'GoogleScienceFair', 'indices': [55, 73]}]",1519,,Twitter Web Client,None,None,None
