tweet_id,name,screen_name,retweet_count,text,mined_at,created_at,favourite_count,hashtags,status_count,location,source_device,retweet_text,quote_text,quote_screen_name
1116153180268580865,Sundar Pichai,sundarpichai,327,"Your Android phone can now be your security key for 2-step verification - it’s built into devices running Android 7.0+, making it easier to log into your Google Account securely https://t.co/jDUgGp1An1",2021-04-15 13:08:06.737182,2019-04-11 01:37:09+00:00,2058,[],1519,,Twitter Web Client,None,None,None
1116143974966648832,Sundar Pichai,sundarpichai,650,RT @Google: ✨Space-cial #GoogleDoodle Alert✨ https://t.co/eCwFjcGkJD,2021-04-15 13:08:06.737182,2019-04-11 01:00:35+00:00,0,"[{'text': 'GoogleDoodle', 'indices': [24, 37]}]",1519,,Twitter Web Client,✨Space-cial #GoogleDoodle Alert✨ https://t.co/eCwFjcGkJD,None,None
1116000804492591104,Sundar Pichai,sundarpichai,306,What an incredible effort by @ehtelescope scientists to capture the first black hole image - huge congrats! https://t.co/2zHuTz85wm,2021-04-15 13:08:06.737182,2019-04-10 15:31:40+00:00,2141,[],1519,,Twitter Web Client,None,None,None
1115828085369315328,Sundar Pichai,sundarpichai,108,"In just over a year into our @Googleorg partnership with @GoodwillIntl, we've helped a quarter of a million Americans learn new digital skills, and 27,000 people find a job. #GrowWithGoogle https://t.co/tfqxKixJmh",2021-04-15 13:08:06.737182,2019-04-10 04:05:21+00:00,1028,"[{'text': 'GrowWithGoogle', 'indices': [174, 189]}]",1519,,Twitter Web Client,None,None,None
1115653858653421568,Sundar Pichai,sundarpichai,441,"Today at #GoogleNext19, we unveiled our vision for a more helpful Cloud. Anthos brings together the simplicity of open-source platforms, Google’s deep technical and security expertise, and the freedom to choose the right cloud partner for the job https://t.co/IHOYuoEcBO",2021-04-15 13:08:06.737182,2019-04-09 16:33:02+00:00,1834,"[{'text': 'GoogleNext19', 'indices': [9, 22]}]",1519,,Twitter Web Client,None,None,None
1115305499140866050,Sundar Pichai,sundarpichai,197,"#GrowWithGoogle coming to NYC: for the next five months, our new classroom space in Chelsea will be open for anyone to learn digital skills to find jobs, advance their career, and grow their business https://t.co/i37tKVM7wN",2021-04-15 13:08:06.737182,2019-04-08 17:28:47+00:00,1460,"[{'text': 'GrowWithGoogle', 'indices': [0, 15]}]",1519,,Twitter for Android,None,None,None
1112732084794060801,Sundar Pichai,sundarpichai,1391,"Gmail turns 15 today, no joke:) Thank you to our 1.5B+ users around the world for all of your support! #HBDGmail https://t.co/4qn9tqw8Y4",2021-04-15 13:08:06.737182,2019-04-01 15:02:57+00:00,10906,"[{'text': 'HBDGmail', 'indices': [103, 112]}]",1519,,Twitter for Android,None,None,None
1110894725358182400,Sundar Pichai,sundarpichai,584,"Congrats to Geoff Hinton, Yoshua Bengio &amp; Yann LeCun on winning this year's Turing Award. Their groundbreaking work on deep neural networks has transformed not just computing and AI, but nearly every other scientific field today https://t.co/EMJvX9UUip",2021-04-15 13:08:06.737182,2019-03-27 13:21:56+00:00,3263,[],1519,,Twitter Web Client,None,None,None
1108776829018488832,Sundar Pichai,sundarpichai,848,Today's #googledoodle is the first ever to be powered by #GoogleAI! Pretty to fun to try out and see how AI and humans can be creative together:) More on the ML model that powers the #BachDoodle: https://t.co/1CC0iFuKiN https://t.co/d5c5ESSIwB,2021-04-15 13:08:06.737182,2019-03-21 17:06:10+00:00,4392,"[{'text': 'googledoodle', 'indices': [8, 21]}, {'text': 'GoogleAI', 'indices': [57, 66]}, {'text': 'BachDoodle', 'indices': [183, 194]}]",1519,,Twitter Web Client,None,None,None
1108223182861819904,Sundar Pichai,sundarpichai,124,"RT @claybavor: I doubt that there is any string of search keywords that would get you to the answer of what kind of car this is.

(It's a v…",2021-04-15 13:08:06.737182,2019-03-20 04:26:11+00:00,0,[],1519,,Twitter Web Client,"I doubt that there is any string of search keywords that would get you to the answer of what kind of car this is.

(It's a variant of a Nash Rambler. Thanks, Google Lens.) https://t.co/65XxQEONSA",None,None
1108074296058929152,Sundar Pichai,sundarpichai,922,"This morning at #GDC2019 we unveiled @GoogleStadia: together with the game community of players, viewers and developers, we can create a new games experience powered by the best of Google and built for everyone https://t.co/RDsucuvIcM https://t.co/aRoCwwAkVg",2021-04-15 13:08:06.737182,2019-03-19 18:34:33+00:00,4847,"[{'text': 'GDC2019', 'indices': [16, 24]}]",1519,,Twitter Web Client,None,None,None
1105875629474377728,Sundar Pichai,sundarpichai,550,"The new Lookout app helps blind or visually impaired people by verbally describing the words, objects, people, etc that are around them. Very proud to see our #googleAI work applied to help users in this way https://t.co/7Bjt4RvKip",2021-04-15 13:08:06.737182,2019-03-13 16:57:50+00:00,2915,"[{'text': 'googleAI', 'indices': [159, 168]}]",1519,,Twitter Web Client,None,None,None
1105740954860847104,Sundar Pichai,sundarpichai,67,RT @VentureBeat: Gboard on Pixel phones now uses an on-device neural network for speech recognition https://t.co/yYV8UZsG8n by @Kyle_L_Wigg…,2021-04-15 13:08:06.737182,2019-03-13 08:02:41+00:00,0,[],1519,,Twitter for Android,Gboard on Pixel phones now uses an on-device neural network for speech recognition https://t.co/yYV8UZsG8n by @Kyle_L_Wiggers,None,None
1105141950804484096,Sundar Pichai,sundarpichai,430,"At I/O last year, gave an update on our #GoogleAI work in detecting diabetic retinopathy. Very encouraged by the continued progress in our efforts, particularly in India https://t.co/YjnZIs4wNa",2021-04-15 13:08:06.737182,2019-03-11 16:22:28+00:00,2619,"[{'text': 'GoogleAI', 'indices': [40, 49]}]",1519,,Twitter for Android,None,None,None
1104288929761521664,Sundar Pichai,sundarpichai,111,"RT @LorraineTwohill: Digital rights are women’s rights, and women’s rights are digital rights. I firmly believe that. Thank you to the @UN…",2021-04-15 13:08:06.737182,2019-03-09 07:52:52+00:00,0,[],1519,,Twitter Web Client,"Digital rights are women’s rights, and women’s rights are digital rights. I firmly believe that. Thank you to the @UN @antonioguterres @UN_Women and @phumzileunwomen for the opportunity to speak and share @Google’s work to get more women online. #InternationalWomensDay https://t.co/6HRcYdCqMV",None,None
1103985641702883328,Sundar Pichai,sundarpichai,779,"Earlier this week, we launched #Bolo in India: a reading tutor app powered by #GoogleAI text-to-speech &amp; speech recognition. Had the chance to visit some students today who are learning to read using Bolo, excited for all the great books they’ll discover! https://t.co/HVwZe4SAMk https://t.co/H6vVYD8SNV",2021-04-15 13:08:06.737182,2019-03-08 11:47:42+00:00,5789,"[{'text': 'Bolo', 'indices': [31, 36]}, {'text': 'GoogleAI', 'indices': [78, 87]}]",1519,"Place(_api=<tweepy.api.API object at 0x00000260A2B20E88>, id='7929cea6bd5b32bd', url='https://api.twitter.com/1.1/geo/id/7929cea6bd5b32bd.json', place_type='city', name='Mumbai', full_name='Mumbai, India', country_code='IN', country='India', contained_within=[], bounding_box=BoundingBox(_api=<tweepy.api.API object at 0x00000260A2B20E88>, type='Polygon', coordinates=[[[72.74484, 18.845343], [73.003648, 18.845343], [73.003648, 19.502937], [72.74484, 19.502937]]]), attributes={})",Twitter Web Client,None,None,None
1103945008648867840,Sundar Pichai,sundarpichai,340,"In Mumbai today and happy to celebrate #IWD2019 with the India chapter of Women@Google at their “I Am Remarkable” event. Thank you for inspiring me with your stories about the experiences, challenges and triumphs of being women in tech. https://t.co/0W8eXVFk3c",2021-04-15 13:08:06.737182,2019-03-08 09:06:15+00:00,4065,"[{'text': 'IWD2019', 'indices': [39, 47]}]",1519,"Place(_api=<tweepy.api.API object at 0x00000260A2B20E88>, id='7929cea6bd5b32bd', url='https://api.twitter.com/1.1/geo/id/7929cea6bd5b32bd.json', place_type='city', name='Mumbai', full_name='Mumbai, India', country_code='IN', country='India', contained_within=[], bounding_box=BoundingBox(_api=<tweepy.api.API object at 0x00000260A2B20E88>, type='Polygon', coordinates=[[[72.74484, 18.845343], [73.003648, 18.845343], [73.003648, 19.502937], [72.74484, 19.502937]]]), attributes={})",Twitter Web Client,None,None,None
1103387226686345217,Sundar Pichai,sundarpichai,283,"TensorFlow Privacy, using techniques based on  differential privacy, will make it easier for developers to train ML models with privacy and better protect users' data in their AI development. #GoogleAI https://t.co/niG8Q6nyye",2021-04-15 13:08:06.737182,2019-03-06 20:09:49+00:00,1694,"[{'text': 'GoogleAI', 'indices': [192, 201]}]",1519,,Twitter Web Client,None,None,None
1101704852592254976,Sundar Pichai,sundarpichai,65,RT @SusanWojcicki: Great to see so many familiar @YouTube @Google faces today at the #LWTSummit! https://t.co/JUdARgkVsH,2021-04-15 13:08:06.737182,2019-03-02 04:44:40+00:00,0,"[{'text': 'LWTSummit', 'indices': [85, 95]}]",1519,,Twitter for Android,Great to see so many familiar @YouTube @Google faces today at the #LWTSummit! https://t.co/JUdARgkVsH,None,None
1100449438777004032,Sundar Pichai,sundarpichai,636,"we’ve been applying ML to better predict and optimize the output of energy at some of our wind farms, boosting its value by 20%. Early results suggest that we can use these algorithms to make wind power more predictable and valuable, exciting to see real-world applications of AI https://t.co/WyW43UIdcQ",2021-04-15 13:08:06.737182,2019-02-26 17:36:06+00:00,3502,[],1519,,Twitter Web Client,None,None,None
1099913059726848000,Sundar Pichai,sundarpichai,77,"RT @harrymccracken: Pssst, this @JRRaphael extravaganza just went live and will change how you think about Google Search. https://t.co/MeBy…",2021-04-15 13:08:06.737182,2019-02-25 06:04:43+00:00,0,[],1519,,Twitter for Android,"Pssst, this @JRRaphael extravaganza just went live and will change how you think about Google Search. https://t.co/MeByLVeB4B",None,None
1095745433870118912,Sundar Pichai,sundarpichai,887,"Today we’re announcing that Google will be investing $13 billion in offices and data centers in the US this year. With this new investment, we’ll now have a home in 24 total states, including data centers in 13 communities. https://t.co/IPZJNPXp5l",2021-04-15 13:08:06.737182,2019-02-13 18:04:04+00:00,7144,[],1519,,Twitter Web Client,None,None,None
1095605780433199104,Sundar Pichai,sundarpichai,361,"Philippines is the 6th country where we'll be launching Google Station, bringing free wifi to 50 locations in the country by the end of this month so that more users can have reliable, high quality access to the internet #Google4PH https://t.co/u6aEhDpxmd",2021-04-15 13:08:06.737182,2019-02-13 08:49:08+00:00,2902,"[{'text': 'Google4PH', 'indices': [221, 231]}]",1519,,Twitter for Android,None,None,None
1095379026716151808,Sundar Pichai,sundarpichai,119,A Cleveland church that once worked with MLK is now working to close the digital divide in black communities. Proud to partner with organizations across the country to help provide digital skills training for everyone. #BlackHistoryMonth #GrowWithGoogle https://t.co/dhwHSdrzsn,2021-04-15 13:08:06.737182,2019-02-12 17:48:05+00:00,1125,"[{'text': 'BlackHistoryMonth', 'indices': [219, 237]}, {'text': 'GrowWithGoogle', 'indices': [238, 253]}]",1519,,Twitter Web Client,None,None,None
1093602810665394177,Sundar Pichai,sundarpichai,334,"Another example of #GoogleAI working at scale to help and protect our users: with our ML models and @TensorFlow, we're now able to detect and block an additional 100M spam messages per day in @gmail https://t.co/MwNqSwJVCz",2021-04-15 13:08:06.737182,2019-02-07 20:10:02+00:00,2586,"[{'text': 'GoogleAI', 'indices': [19, 28]}]",1519,,Twitter Web Client,None,None,None
1092893436582096897,Sundar Pichai,sundarpichai,919,"Today, we’re introducing two new updates that will help keep your data secure: Password Checkup, a Chrome extension that helps protect your accounts from third party data breaches, and a new feature called Cross Account Protection #saferinternetday
https://t.co/L4JSztM69Q https://t.co/CuHKYF1Ghh",2021-04-15 13:08:06.737182,2019-02-05 21:11:14+00:00,3585,"[{'text': 'saferinternetday', 'indices': [231, 248]}]",1519,,Twitter Web Client,None,None,None
1092465807043383298,Sundar Pichai,sundarpichai,173,RT @LaurenGoode: Google’s newest apps offer live transcriptions and sound amplification for the deaf and hard-of-hearing. While the apps wo…,2021-04-15 13:08:06.738181,2019-02-04 16:52:00+00:00,0,[],1519,,Twitter for Android,"Google’s newest apps offer live transcriptions and sound amplification for the deaf and hard-of-hearing. While the apps work in a straightforward way right now, it’s easy to see a future in which these apps recognize where we are and adjust automatically  https://t.co/rH0BN1kvIK",None,None
1091414939938447360,Sundar Pichai,sundarpichai,379,🦉😉 https://t.co/CWtsZtqLU0,2021-04-15 13:08:06.738181,2019-02-01 19:16:13+00:00,5476,[],1519,,Twitter for Android,None,None,None
1088935342382534656,Sundar Pichai,sundarpichai,1114,Glad the transmission was received:) See you at Shoreline Amphitheatre May 7-9 for this year's I/O! #io19 https://t.co/CXWpQR4Eza,2021-04-15 13:08:06.738181,2019-01-25 23:03:11+00:00,6381,"[{'text': 'io19', 'indices': [100, 105]}]",1519,,Twitter Web Client,None,None,None
1087856611371114496,Sundar Pichai,sundarpichai,257,Thrilled to celebrate the opening of our new #Berlin office! (And shout out to Berlin-based artist Roman Lipski for his cool mural created with the help of #AI) https://t.co/EKH797cMEK,2021-04-15 13:08:06.738181,2019-01-22 23:36:42+00:00,3515,"[{'text': 'Berlin', 'indices': [45, 52]}, {'text': 'AI', 'indices': [156, 159]}]",1519,,Twitter for Android,None,None,None
1087783470225448960,Sundar Pichai,sundarpichai,313,"So happy to be back in Germany! First stop was a chat with the students @TUBerlin about AI and responsible innovation. Thanks so much for having me, and for all of your thoughtful questions - sorry we didn't have time to get to all 300 of them!:) https://t.co/FF7ca72IaK",2021-04-15 13:08:06.738181,2019-01-22 18:46:03+00:00,5048,[],1519,,Twitter for Android,None,None,None
1087473107529416704,Sundar Pichai,sundarpichai,316,"Great discussion with leaders from across Central &amp; Eastern Europe about the region’s potential as Digital Challengers. Google is committed to supporting them: we're investing $20M by 2020 in programs &amp; training to help people grow their skills, careers and businesses. https://t.co/UpJxUuYD5L",2021-04-15 13:08:06.738181,2019-01-21 22:12:47+00:00,3357,[],1519,,Twitter Web Client,None,None,None
1087376584397381635,Sundar Pichai,sundarpichai,23,"@PremierRP @MorawieckiM @Google Thank you Prime Minister @MorawieckiM for our discussion about the opportunities that technology brings, and how we can work together to ensure that it serves everyone",2021-04-15 13:08:06.738181,2019-01-21 15:49:14+00:00,522,[],1519,,Twitter Web Client,None,None,None
1087367261151588353,Sundar Pichai,sundarpichai,254,"Today our doodle honors the life and work of Dr. Martin Luther King, Jr. Special thanks to guest artist Xia Gordon (@carefulblackgrl) for her beautiful artwork. #MLKDay https://t.co/5zkJGrwRtW",2021-04-15 13:08:06.738181,2019-01-21 15:12:12+00:00,2368,"[{'text': 'MLKDay', 'indices': [161, 168]}]",1519,,Twitter Web Client,None,None,None
1085407150078332928,Sundar Pichai,sundarpichai,196,Great summary of our Research and AI work in 2018 from @JeffDean and @GoogleAI https://t.co/dunp1pQzeQ,2021-04-15 13:08:06.738181,2019-01-16 05:23:25+00:00,1946,[],1519,,Twitter Web Client,None,None,None
1082509102486499328,Sundar Pichai,sundarpichai,106,So great to have @JimmyFallon @KermitTheFrog @MandyRheaWrites as our guest judges for #DoodleForGoogle this year! Also check out 2018 US winner 1st grader Sarah Gomez-Lane's doodle live on our homepage right now:) https://t.co/JXKR1qYoK7,2021-04-15 13:08:06.738181,2019-01-08 05:27:36+00:00,1290,"[{'text': 'DoodleForGoogle', 'indices': [86, 102]}]",1519,,Twitter Web Client,None,None,None
1082177147962241024,Sundar Pichai,sundarpichai,212,"Nice in depth look from the Times on @demishassabis and @DeepMindAI effort, excited at the progress around AlphaZero and AlphaFold! https://t.co/AkLqlvLUnl",2021-04-15 13:08:06.738181,2019-01-07 07:28:32+00:00,1660,[],1519,,Twitter Web Client,None,None,None
1075834333087158272,Sundar Pichai,sundarpichai,210,"The First Step Act is an important moment in reforming our criminal justice system to ensure it’s equal, consistent and fair for everyone. Google &amp; @googleorg have long backed efforts to improve the system - more to be done, but encouraging news! https://t.co/JVdz3hS1Sz",2021-04-15 13:08:06.738181,2018-12-20 19:24:27+00:00,1943,[],1519,,Twitter for Android,None,None,None
1073320240417714176,Sundar Pichai,sundarpichai,271,"In Sept, a fire struck the National Museum of Brazil, home to one of the largest collections of natural history in the world. An estimated 20M pieces were lost. Through partnership w/ @MuseuNacional, we’re proud to help bring the lost collection online https://t.co/LuANOZ6us0",2021-04-15 13:08:06.738181,2018-12-13 20:54:21+00:00,2179,[],1519,,Twitter Web Client,None,None,None
1072764372160675840,Sundar Pichai,sundarpichai,1392,"In a year of ups and downs, the world searched for ""good"" more than ever before. Here’s to all the good moments from 2018 and all the people who searched for them. #YearInSearch https://t.co/hj2FnX4mR4",2021-04-15 13:08:06.738181,2018-12-12 08:05:31+00:00,7951,"[{'text': 'YearInSearch', 'indices': [164, 177]}]",1519,,Twitter Web Client,None,None,None
1070163603590852608,Sundar Pichai,sundarpichai,46,"RT @Jacqfuller: With @GoogleOrg's $2M grant, @TLM will expand their program to prepare incarcerated individuals for successful re-entry to…",2021-04-15 13:08:06.738181,2018-12-05 03:51:00+00:00,0,[],1519,,Twitter for Android,"With @GoogleOrg's $2M grant, @TLM will expand their program to prepare incarcerated individuals for successful re-entry to the job market. Thank you to @GovHolcomb @MCHammer and @RealSway for joining us today! 

Learn more: https://t.co/BvmC6lHF20 https://t.co/QGAAx46UlD",None,None
1069785220193243136,Sundar Pichai,sundarpichai,476,"At Google, our best stuff comes not from 'lone inventors,' but from people working together. Often over coffee or soft-serve. Fortunate to work with Sanjay and @JeffDean https://t.co/1CoXrhuH8v",2021-04-15 13:08:06.738181,2018-12-04 02:47:26+00:00,3139,[],1519,,Twitter for Android,None,None,None
1069770210817794048,Sundar Pichai,sundarpichai,57,RT @Gizmodo: Google's virtual Vermeer museum is a legitimately cool use of AR https://t.co/7KVOCnBoEG https://t.co/g2ED57GbBM,2021-04-15 13:08:06.738181,2018-12-04 01:47:48+00:00,0,[],1519,,Twitter Web Client,Google's virtual Vermeer museum is a legitimately cool use of AR https://t.co/7KVOCnBoEG https://t.co/g2ED57GbBM,None,None
1069751685201846272,Sundar Pichai,sundarpichai,193,"RT @Google: In our 48-hour hackathon with @AdaptiveDesign, five kids worked with designers and developers to prototype games to make learni…",2021-04-15 13:08:06.738181,2018-12-04 00:34:11+00:00,0,[],1519,,Twitter Web Client,"In our 48-hour hackathon with @AdaptiveDesign, five kids worked with designers and developers to prototype games to make learning Morse code fun → https://t.co/6R7i2xk4WK https://t.co/uZXDPoOE9i",None,None
1069725151250460672,Sundar Pichai,sundarpichai,63,We're proud to support #CSEdWeek and #HourOfCode with #CSFirst activities like this one - happy coding! https://t.co/jOCCnkEK8Q,2021-04-15 13:08:06.738181,2018-12-03 22:48:45+00:00,644,"[{'text': 'CSEdWeek', 'indices': [23, 32]}, {'text': 'HourOfCode', 'indices': [37, 48]}, {'text': 'CSFirst', 'indices': [54, 62]}]",1519,,Twitter Web Client,None,None,None
1069450462284267520,Sundar Pichai,sundarpichai,153,Excited to see the progress in such an important area from @DeepMindAI https://t.co/MoSuiEN9JD,2021-04-15 13:08:06.738181,2018-12-03 04:37:14+00:00,1680,[],1519,,Twitter Web Client,None,None,None
1069107440656908288,Sundar Pichai,sundarpichai,28431,RT @FCBarcelona: ⬇️ List of players better than Messi 🐐 https://t.co/kFSrZ0868u,2021-04-15 13:08:06.738181,2018-12-02 05:54:11+00:00,0,[],1519,,Twitter for Android,⬇️ List of players better than Messi 🐐 https://t.co/kFSrZ0868u,None,None
1068737829679722496,Sundar Pichai,sundarpichai,16,@georgepbush Sorry for your loss and may his memory be a blessing,2021-04-15 13:08:06.738181,2018-12-01 05:25:29+00:00,637,[],1519,,Twitter Web Client,None,None,None
1068735802727776256,Sundar Pichai,sundarpichai,929,Saddened by the passing of President George H.W. Bush. Thank you for your lifetime of tireless service and leadership to our country. RIP,2021-04-15 13:08:06.738181,2018-12-01 05:17:26+00:00,10307,[],1519,,Twitter Web Client,None,None,None
1068167487336792064,Sundar Pichai,sundarpichai,388,Libraries are hubs for knowledge &amp; learning in every community - thrilled we’re expanding our partnership with @ALALibrary and working with local libraries to provide #GrowWithGoogle digital skills training across the US. https://t.co/ACLuezqsCh,2021-04-15 13:08:06.738181,2018-11-29 15:39:09+00:00,3021,"[{'text': 'GrowWithGoogle', 'indices': [171, 186]}]",1519,,Twitter for Android,None,None,None
1065723327078064128,Sundar Pichai,sundarpichai,209,We're thankful for all of the first responders who continue to battle the wildfires in California and help those who were displaced. There's much more to be done and we’ll stay engaged in support of recovery efforts. https://t.co/EQTyVjCUBc,2021-04-15 13:08:06.738181,2018-11-22 21:46:56+00:00,2595,[],1519,,Twitter for Android,None,None,None
1062411746399281152,Sundar Pichai,sundarpichai,99,RT @demishassabis: We are immensely proud of all the Streams team has achieved. DeepMind will continue to lead the way in fundamental resea…,2021-04-15 13:08:06.738181,2018-11-13 18:27:53+00:00,0,[],1519,,Twitter for Android,"We are immensely proud of all the Streams team has achieved. DeepMind will continue to lead the way in fundamental research applying AI to important science and medical research questions, in collaboration w/partners, to accelerate scientific progress for the benefit of everyone https://t.co/msy808pJVA",None,None
1061668887094210560,Sundar Pichai,sundarpichai,339,Thank you to all veterans for your service and for the sacrifices you've made to protect our freedom. Our doodle today honors you and your stories. https://t.co/dhTBsYJaus,2021-04-15 13:08:06.738181,2018-11-11 17:16:02+00:00,4774,[],1519,,Twitter for Android,None,None,None
1060995507240103936,Sundar Pichai,sundarpichai,300,"We are mobilizing to support those impacted by the #CampFire, #HillFire and #WoolseyFire with SOS Alerts, and committing resources from @googleorg to aid those in need. Our thoughts are with all those displaced by these fires.",2021-04-15 13:08:06.738181,2018-11-09 20:40:15+00:00,3568,"[{'text': 'CampFire', 'indices': [51, 60]}, {'text': 'HillFire', 'indices': [62, 71]}, {'text': 'WoolseyFire', 'indices': [76, 88]}]",1519,,Twitter Web Client,None,None,None
1060774195376738304,Sundar Pichai,sundarpichai,111,RT @stshank: The @GoogleAI and @googlecloud folks are helping the @nytimes process 5-7 million analog photos from its morgue dating back to…,2021-04-15 13:08:06.738181,2018-11-09 06:00:51+00:00,0,[],1519,,Twitter for Android,"The @GoogleAI and @googlecloud folks are helping the @nytimes process 5-7 million analog photos from its morgue dating back to the 1870s. The fruits of the labor will be more NYT history pieces. They’re not using image recognition, though, at least yet. https://t.co/ls1PzvRfbw",None,None
1059861523747618816,Sundar Pichai,sundarpichai,2207,RT @Google: Go Vote: Here’s where to find the information you need to make your voice heard on #ElectionDay.,2021-04-15 13:08:06.738181,2018-11-06 17:34:13+00:00,0,"[{'text': 'ElectionDay', 'indices': [95, 107]}]",1519,,Twitter Web Client,Go Vote: Here’s where to find the information you need to make your voice heard on #ElectionDay.,None,None
1059699010401759238,Sundar Pichai,sundarpichai,725,RT @AndrewCrow: Amazing change to Google's site. #GoVote https://t.co/cnQwJp09TI,2021-04-15 13:08:06.738181,2018-11-06 06:48:26+00:00,0,"[{'text': 'GoVote', 'indices': [49, 56]}]",1519,,Twitter Web Client,Amazing change to Google's site. #GoVote https://t.co/cnQwJp09TI,None,None
1056969127569448960,Sundar Pichai,sundarpichai,1287,"We’re announcing our AI for Social Good program, applying @GoogleAI expertise to projects w/ positive societal impact. We invite researchers &amp; orgs to submit ideas for the #GoogleAI Impact Challenge: @googleorg will fund $25M in grants to chosen projects https://t.co/W3BMoueTYo",2021-04-15 13:08:06.738181,2018-10-29 18:00:52+00:00,4711,"[{'text': 'GoogleAI', 'indices': [176, 185]}]",1519,,Twitter Web Client,None,None,None
1054608316259651584,Sundar Pichai,sundarpichai,50,RT @guardian: Google Home Hub review: the smart display to buy https://t.co/SELJ1z7Huh,2021-04-15 13:08:06.738181,2018-10-23 05:39:50+00:00,0,[],1519,,Twitter for Android,Google Home Hub review: the smart display to buy https://t.co/SELJ1z7Huh,None,None
